tweet,date,stats,query
Go get you a betterhelp coupon and go to talk therapy if other people being “ungrateful” for their chronic pain is causing you such emotional distress. Jesus Christ.,2026-04-20 10:47:00-05:00,"(43, 0, 1, 0)",betterhelp since:2026-02-01
"This week's Art of Fatherhood podcast is with Chip Leighton We talk fatherhood, his new book, Dad Can You Not? from @countrymanpress & more. Thanks to @betterhelp for sponsoring this week's episode. artoffatherhood.net/chip-lei… #fatherhood #newbook #author #family #dadjokes @wwnorton",2026-04-20 09:51:00-05:00,"(165, 10, 0, 6)",betterhelp since:2026-02-01
go on betterhelp dot com tell em you’re schizophrenic,2026-04-20 07:34:00-05:00,"(41, 3, 1, 0)",betterhelp since:2026-02-01
"""Tech Billionaires Want Christians to Believe in AI. For Peter Thiel and JD Vance allies, the tech right is framing AI as a moral—even divine—mission."" motherjones.com/politics/202…",2026-04-20 05:52:00-05:00,"(50, 0, 1, 0)",betterhelp since:2026-02-01
"""Tech Billionaires Want Christians to Believe in AI. For Peter Thiel and JD Vance allies, the tech right is framing AI as a moral—even divine—mission."" motherjones.com/politics/202…",2026-04-20 05:52:00-05:00,"(51, 0, 1, 0)",betterhelp since:2026-02-01
"""Tech Billionaires Want Christians to Believe in AI. For Peter Thiel and JD Vance allies, the tech right is framing AI as a moral—even divine—mission."" motherjones.com/politics/202…",2026-04-20 05:52:00-05:00,"(53, 0, 1, 0)",betterhelp since:2026-02-01
"""Tech Billionaires Want Christians to Believe in AI. For Peter Thiel and JD Vance allies, the tech right is framing AI as a moral—even divine—mission."" motherjones.com/politics/202…",2026-04-20 05:52:00-05:00,"(48, 0, 1, 0)",betterhelp since:2026-02-01
"""A broker with the insurance company, Crombie Lockwood, said he was instructed to use a special code with Brethren clients, discounting his commission by 20% which went to the listed ""sub-agency"", UBT (Universal Business Team) a church-controlled company."" rnz.co.nz/news/national/4716…",2026-04-20 05:44:00-05:00,"(67, 0, 1, 0)",betterhelp since:2026-02-01
"""A broker with the insurance company, Crombie Lockwood, said he was instructed to use a special code with Brethren clients, discounting his commission by 20% which went to the listed ""sub-agency"", UBT (Universal Business Team) a church-controlled company."" rnz.co.nz/news/national/4716…",2026-04-20 05:44:00-05:00,"(64, 0, 1, 0)",betterhelp since:2026-02-01
"""A broker with the insurance company, Crombie Lockwood, said he was instructed to use a special code with Brethren clients, discounting his commission by 20% which went to the listed ""sub-agency"", UBT (Universal Business Team) a church-controlled company."" rnz.co.nz/news/national/4716…",2026-04-20 05:44:00-05:00,"(38, 0, 1, 0)",betterhelp since:2026-02-01
"""A broker with the insurance company, Crombie Lockwood, said he was instructed to use a special code with Brethren clients, discounting his commission by 20% which went to the listed ""sub-agency"", UBT (Universal Business Team) a church-controlled company."" rnz.co.nz/news/national/4716…",2026-04-20 05:44:00-05:00,"(46, 0, 1, 0)",betterhelp since:2026-02-01
"""A broker with the insurance company, Crombie Lockwood, said he was instructed to use a special code with Brethren clients, discounting his commission by 20% which went to the listed ""sub-agency"", UBT (Universal Business Team) a church-controlled company."" rnz.co.nz/news/national/4716…",2026-04-20 05:44:00-05:00,"(36, 0, 1, 0)",betterhelp since:2026-02-01
"""A broker with the insurance company, Crombie Lockwood, said he was instructed to use a special code with Brethren clients, discounting his commission by 20% which went to the listed ""sub-agency"", UBT (Universal Business Team) a church-controlled company."" rnz.co.nz/news/national/4716…",2026-04-20 05:43:00-05:00,"(69, 0, 1, 0)",betterhelp since:2026-02-01
Exclusive Brethren told to 'create a crisis' to generate profits thepost.co.nz/nz-news/350113…,2026-04-20 05:03:00-05:00,"(55, 0, 1, 0)",betterhelp since:2026-02-01
Exclusive Brethren told to 'create a crisis' to generate profits thepost.co.nz/nz-news/350113…,2026-04-20 05:03:00-05:00,"(32, 0, 1, 0)",betterhelp since:2026-02-01
Exclusive Brethren told to 'create a crisis' to generate profits thepost.co.nz/nz-news/350113…,2026-04-20 05:02:00-05:00,"(54, 0, 1, 0)",betterhelp since:2026-02-01
Exclusive Brethren told to 'create a crisis' to generate profits thepost.co.nz/nz-news/350113…,2026-04-20 04:59:00-05:00,"(34, 0, 1, 0)",betterhelp since:2026-02-01
Exclusive Brethren told to 'create a crisis' to generate profits thepost.co.nz/nz-news/350113…,2026-04-20 04:58:00-05:00,"(46, 0, 1, 0)",betterhelp since:2026-02-01
Exclusive Brethren told to 'create a crisis' to generate profits thepost.co.nz/nz-news/350113…,2026-04-20 04:58:00-05:00,"(40, 0, 1, 0)",betterhelp since:2026-02-01
The Future of Therapy - Research About The 'Uberization' of Mental Health Services thefutureoftherapy.org/,2026-04-20 04:35:00-05:00,"(54, 0, 1, 0)",betterhelp since:2026-02-01
Podcast ad spending just hit the highest Q1 on record. Top 10 advertisers spent $132.8M. BetterHelp alone: $20M in three months. The ad dollars aren't disappearing. They're finding the creators who actually move product.,2026-04-20 03:00:00-05:00,"(40, 0, 0, 0)",betterhelp since:2026-02-01
The Future of Therapy - Research About The 'Uberization' of Mental Health Services thefutureoftherapy.org/,2026-04-20 02:54:00-05:00,"(93, 0, 1, 0)",betterhelp since:2026-02-01
Between DraftKings and BetterHelp,2026-04-20 00:50:00-05:00,"(109, 0, 0, 0)",betterhelp since:2026-02-01
Betterhelp? More like betterhandjob 🥁 💿 🎉 😬 🔫,2026-04-19 23:59:00-05:00,"(138, 2, 0, 0)",betterhelp since:2026-02-01
I don't know what's funnier: getting sponsored by friendslop or only being sponsored by BetterHelp when at least one combatant is insane,2026-04-19 22:38:00-05:00,"(218, 2, 0, 0)",betterhelp since:2026-02-01
"Go finish getting cooked by @TalentOverHype , also start with betterhelp. This is a mental illness (not an ad)",2026-04-19 21:55:00-05:00,"(19, 0, 1, 0)",betterhelp since:2026-02-01
So depressed i got an ad for betterhelp and genuinely filled out the entire questionnaire and then had a moment of realization and stopped,2026-04-19 18:12:00-05:00,"(115, 10, 1, 0)",betterhelp since:2026-02-01
"Hahahahaha, who said anything about being black? I think you need to give a therapist a call, you really need it. BetterHelp doesn’t require insurance if that’s something you’re worried about.",2026-04-19 17:25:00-05:00,"(14, 0, 0, 0)",betterhelp since:2026-02-01
@FitzMagic_14 @NBAonPrime @RSherman_25 @StateFarm @progressive @AllAmericanRoof @Tubi @PlutoTV @AmazonAlexa @JColeNC @LarryJuneTFM @betterhelp @rihanna @TheBocaRaton @NICKIMINAJ @Drake @AmazonMGMStudio @2chainz @esnyinc @jackblack welcome! You are a cast stoner!,2026-04-19 13:31:00-05:00,"(25, 0, 1, 0)",betterhelp since:2026-02-01
@FitzMagic_14 @NBAonPrime @RSherman_25 @StateFarm @progressive @AllAmericanRoof @Tubi @PlutoTV @AmazonAlexa @JColeNC @LarryJuneTFM @betterhelp @rihanna @TheBocaRaton @NICKIMINAJ @Drake @AmazonMGMStudio @2chainz @esnyinc @jackblack welcome! You are a cast stoner!,2026-04-19 13:00:00-05:00,"(20, 0, 1, 0)",betterhelp since:2026-02-01
"BetterHelp is hiring Senior Database Engineer — Remote Up to $180K Own Aurora MySQL clusters, tuning Laravel/Eloquent queries and designing scalable schemas. Link in reply. #database #mysql #aws",2026-04-19 12:56:00-05:00,"(35, 0, 2, 0)",betterhelp since:2026-02-01
@FitzMagic_14 @NBAonPrime @RSherman_25 @StateFarm @progressive @AllAmericanRoof @Tubi @PlutoTV @AmazonAlexa @JColeNC @LarryJuneTFM @betterhelp @rihanna @TheBocaRaton @NICKIMINAJ @Drake @AmazonMGMStudio @2chainz @esnyinc @jackblack welcome! You are a cast stoner!,2026-04-19 12:26:00-05:00,"(24, 0, 1, 0)",betterhelp since:2026-02-01
she was the blueprint that inspired betterhelp,2026-04-19 12:05:00-05:00,"(57, 3, 0, 0)",betterhelp since:2026-02-01
"BetterHelp: Dark Commercial Patterns and Billing Errors Explained. ""The system was designed with major flaws which allow the company to syphon money."" theartistryofglorifiedbullsh…",2026-04-19 09:00:00-05:00,"(5, 0, 0, 0)",betterhelp since:2026-02-01
NEW EPISODE ALERT! Join us today as we take a look at the case of Mackenzie Shirilla. Available now! #cooldownbeers #podcast #betterhelp,2026-04-19 08:31:00-05:00,"(913, 10, 1, 3)",betterhelp since:2026-02-01
"Somebody ban this fucking betterhelp and let me watch my video. Dont you fucking get it video is my only therapy, thats the only cheapest way i can get my therapy and you come inbetween distrupting me telling why am i avoiding help?! man fuck off trynna piss me beg moneyonstreet",2026-04-19 08:06:00-05:00,"(8, 0, 0, 0)",betterhelp since:2026-02-01
Sequel but this time the villain isn’t a demon but BetterHelp ads,2026-04-19 07:28:00-05:00,"(99, 1, 0, 0)",betterhelp since:2026-02-01
i’m scrolling through tiktok going through lingorms situationship era and every other ad is for betterhelp telling me to get a therapist…what’s that supposed to mean?,2026-04-19 07:20:00-05:00,"(661, 27, 1, 3)",betterhelp since:2026-02-01
freezai sponsored betterhelp and deleted comments calling it out so theres a reason to hate him 😍,2026-04-19 07:01:00-05:00,"(56, 1, 0, 0)",betterhelp since:2026-02-01
The IAPT Service Is an Abject Failure madintheuk.com/2022/09/iapt-… via @MITUKTeam @michaeljscott20,2026-04-19 05:02:00-05:00,"(48, 0, 1, 0)",betterhelp since:2026-02-01
The IAPT Service Is an Abject Failure madintheuk.com/2022/09/iapt-… via @MITUKTeam @michaeljscott20,2026-04-19 05:01:00-05:00,"(65, 0, 1, 0)",betterhelp since:2026-02-01
The IAPT Service Is an Abject Failure madintheuk.com/2022/09/iapt-… via @MITUKTeam @michaeljscott20,2026-04-19 05:00:00-05:00,"(61, 0, 1, 0)",betterhelp since:2026-02-01
The IAPT Service Is an Abject Failure madintheuk.com/2022/09/iapt-… via @MITUKTeam @michaeljscott20,2026-04-19 04:59:00-05:00,"(40, 0, 1, 0)",betterhelp since:2026-02-01
The IAPT Service Is an Abject Failure madintheuk.com/2022/09/iapt-… via @MITUKTeam @michaeljscott20,2026-04-19 04:59:00-05:00,"(48, 0, 1, 0)",betterhelp since:2026-02-01
"Látom, hogy engem targetál a betterhelp nevű oldal, amit én nem ismerek. Én egyáltalán nem szeretnék semmilyen terápiára sem járni, ez nem a pszichiáter személyén múlik. Viszont a gyógyszereket szednem kell, különben lehet, hogy meghalnék, sajnos így maradtam az elmúlt évek során",2026-04-19 04:05:00-05:00,"(4, 0, 2, 0)",betterhelp since:2026-02-01
"If you have clinical issues or trauma, you need a licensed therapist on BetterHelp. If your main issue is how you communicate during fights, paying 30x more for scheduled sessions might not solve the core problem. 4/5",2026-04-19 01:46:00-05:00,"(4, 0, 1, 0)",betterhelp since:2026-02-01
"BetterHelp operates on a schedule. Your session is Thursday at 7 PM. But your worst fights happen on Monday at 10 PM. By the time you talk to a therapist, the damage is already done. 2/5",2026-04-19 01:46:00-05:00,"(7, 0, 1, 0)",betterhelp since:2026-02-01
I spent time comparing the actual use cases for LoveFix and BetterHelp. The biggest difference is not the massive price gap. It is about when the help arrives. 🧵 1/5,2026-04-19 01:46:00-05:00,"(3, 1, 1, 0)",betterhelp since:2026-02-01
"marcus fenix shortly after watching lieutenant kim get split open by locust general pat mcafee's sword: ANYA, i need a betterhelp subscription strike on my mark ASAP!",2026-04-18 22:52:00-05:00,"(3966, 29, 0, 0)",betterhelp since:2026-02-01
"BetterHelp has online therapy. Use it coach. If you need anything, I'm here for you",2026-04-18 21:15:00-05:00,"(52, 2, 0, 1)",betterhelp since:2026-02-01
BetterHelp is to therapy what Duolingo is to learning languages,2026-04-18 20:41:00-05:00,"(14, 0, 0, 0)",betterhelp since:2026-02-01
like i genuinely don’t care about men crying about mental health when it’s the 21st century and by gods if you can’t get insured therapy JUST USE THE BETTERHELP GET A BOOK MEDITATE I DONT KNOW BUT STOP KILLING EVERYONE ELSE,2026-04-18 16:55:00-05:00,"(51, 1, 1, 0)",betterhelp since:2026-02-01
Overworked and Underpaid: UK Therapists Respond to US Online Platform BetterHelp welldoing.org/article/overwo…,2026-04-18 16:24:00-05:00,"(59, 0, 2, 0)",betterhelp since:2026-02-01
so there’s this website called betterhelp,2026-04-18 16:19:00-05:00,"(71, 2, 0, 0)",betterhelp since:2026-02-01
Overworked and Underpaid: UK Therapists Respond to US Online Platform BetterHelp welldoing.org/article/overwo…,2026-04-18 16:18:00-05:00,"(33, 0, 0, 0)",betterhelp since:2026-02-01
Overworked and Underpaid: UK Therapists Respond to US Online Platform BetterHelp welldoing.org/article/overwo…,2026-04-18 16:14:00-05:00,"(12, 1, 0, 1)",betterhelp since:2026-02-01
"Today on LandingRoles: → 1,002 new remote jobs indexed → 262 paying $150K+ → 142 sales · 79 healthcare · 68 operations → Top hiring: Cresta (42), BetterHelp (25), ABC Legal Services (19) → Hottest stack: Salesforce (24 jobs) Browse → #remotejobs #techjobs #hiring",2026-04-18 16:04:00-05:00,"(58, 0, 2, 0)",betterhelp since:2026-02-01
BetterHelp or BetterNot? Ensuring Mental Health Tech Innovation is Psychologically Sound. aaronbalick.com/post/betterh…,2026-04-18 14:31:00-05:00,"(45, 0, 0, 1)",betterhelp since:2026-02-01
guys ive actually been larping the entire time every time i tweet its from my prebuilt pc running ubuntu with GNOME on the website via google chrome in which i have honey installed to get good deals on all my favorite products and i meet weekly with my betterhelp professional,2026-04-18 14:27:00-05:00,"(73, 2, 0, 0)",betterhelp since:2026-02-01
And now you’re all twisted up. I’m just fucking around but all you read was truth in my words. Maybe it’s time to use one of those stupid online therapy services like BetterHelp™️ that advertise on the goofball political podcasts you listen to.,2026-04-18 14:19:00-05:00,"(11, 0, 1, 0)",betterhelp since:2026-02-01
BetterHelp TR — 8.8/10 ⭐ 🏅 Uluslararası Standart | En İyi Online Terapi 💰 ₺900/seans enrehber.com/en-iyi-online-t…,2026-04-18 13:40:00-05:00,"(21, 1, 0, 1)",betterhelp since:2026-02-01
@betterhelp,2026-04-18 12:49:00-05:00,"(7, 0, 0, 0)",betterhelp since:2026-02-01
"""They cast the NHS Charities Together campaign as a mask behind which chronic underfunding and increasingly unequal services could be hidden and allowed to continue."" thepolyphony.org/2024/10/24/…",2026-04-18 12:14:00-05:00,"(102, 2, 1, 2)",betterhelp since:2026-02-01
"I don’t care if you have “mental health problems” or not, but either way, you can’t kill your wife at home with the kids there. Therapy and resources are more accessible than ever. Put Betterhelp and Talkspace on Klarna if you have to!!",2026-04-18 12:13:00-05:00,"(143, 3, 0, 0)",betterhelp since:2026-02-01
@talkspace,2026-04-18 12:03:00-05:00,"(13, 0, 0, 0)",betterhelp since:2026-02-01
"No Help Available | 988 Suicide & Crisis Lifeline: ""Someone types ""I am thinking about killing myself"" into an app that marketed itself as mental health support, and nearly half the time, the system couldn't even point them to a working crisis line."" linkedin.com/pulse/911-numbe…",2026-04-18 11:51:00-05:00,"(86, 0, 1, 0)",betterhelp since:2026-02-01
"No Help Available | 988 Suicide & Crisis Lifeline: ""Someone types ""I am thinking about killing myself"" into an app that marketed itself as mental health support, and nearly half the time, the system couldn't even point them to a working crisis line."" linkedin.com/pulse/911-numbe…",2026-04-18 11:51:00-05:00,"(114, 0, 1, 0)",betterhelp since:2026-02-01
Shut up you fucking maniac. @betterhelp,2026-04-18 11:33:00-05:00,"(19, 0, 0, 0)",betterhelp since:2026-02-01
"""Every great cause starts as a movement, becomes a business, and degenerates in a racket."" ""Dramatic growth in mental-health apps has created a risky industry. Customers’ “emotional data” can be hacked, and no one is checking if the apps work."" teddit.net/r/technology/comm…",2026-04-18 08:46:00-05:00,"(113, 0, 1, 1)",betterhelp since:2026-02-01
"""Every great cause starts as a movement, becomes a business, and degenerates in a racket."" ""Dramatic growth in mental-health apps has created a risky industry. Customers’ “emotional data” can be hacked, and no one is checking if the apps work."" teddit.net/r/technology/comm…",2026-04-18 08:45:00-05:00,"(55, 0, 1, 0)",betterhelp since:2026-02-01
"They keep winning at proving how mediocre they are! Their only play is to copy the Sussexes & be completely rubbish at it!🤷🏾‍♀️ Like guys, turn the page! 📑 It’s been 6 YEARS l! Get a life coach therapy is clearly not enough! Maybe use @betterhelp so no one knows! Do something!",2026-04-18 08:36:00-05:00,"(44, 2, 0, 0)",betterhelp since:2026-02-01
"Uber Eats BetterHelp Upsell ""I highly doubt Uber ever launches this, as it cannibalizes their business and would likely make a lot of people mad (though some small subset of the population might be helped by it"". sorens.beehiiv.com/p/uber-ea… @ubereats @BetterHelp @BACP",2026-04-18 07:50:00-05:00,"(161, 1, 2, 2)",betterhelp since:2026-02-01
"I'm listening to @melrobbins podcast episode in @PodcastRepublic app. Gone are the days of ads in podcasts for ziprecruiter , betterhelp, etc mostly irrelevant but mildly interesting stuff. This one has ads for GRT JEWELLERS AKSHAYA TRITIYA ! ! It gave me FM Radio feels. 😠",2026-04-18 07:39:00-05:00,"(29, 0, 0, 0)",betterhelp since:2026-02-01
"Uber Eats BetterHelp Upsell ""I highly doubt Uber ever launches this, as it cannibalizes their business and would likely make a lot of people mad (though some small subset of the population might be helped by it"". sorens.beehiiv.com/p/uber-ea… @ubereats @BetterHelp @BACP",2026-04-18 07:34:00-05:00,"(85, 1, 1, 2)",betterhelp since:2026-02-01
"Uber Eats BetterHelp Upsell ""I highly doubt Uber ever launches this, as it cannibalizes their business and would likely make a lot of people mad (though some small subset of the population might be helped by it"". sorens.beehiiv.com/p/uber-ea… @ubereats @BetterHelp @BACP",2026-04-18 07:14:00-05:00,"(54, 1, 1, 1)",betterhelp since:2026-02-01
"Uber Eats BetterHelp Upsell ""I highly doubt Uber ever launches this, as it cannibalizes their business and would likely make a lot of people mad (though some small subset of the population might be helped by it"". sorens.beehiiv.com/p/uber-ea… @ubereats @BetterHelp @BACP",2026-04-18 07:14:00-05:00,"(58, 1, 1, 1)",betterhelp since:2026-02-01
"Uber Eats BetterHelp Upsell ""I highly doubt Uber ever launches this, as it cannibalizes their business and would likely make a lot of people mad (though some small subset of the population might be helped by it"". sorens.beehiiv.com/p/uber-ea… @ubereats @BetterHelp @BACP",2026-04-18 07:13:00-05:00,"(69, 2, 2, 2)",betterhelp since:2026-02-01
UK told its Big Tech habit is now a national security risk theregister.com/2026/04/15/u…,2026-04-18 05:56:00-05:00,"(75, 0, 1, 1)",betterhelp since:2026-02-01
UK told its Big Tech habit is now a national security risk theregister.com/2026/04/15/u…,2026-04-18 05:56:00-05:00,"(43, 0, 1, 0)",betterhelp since:2026-02-01
Why have counsellors been linked into unsafe therapy apps and crisis text lines? @BetterHelp @EAPA_UK @TeladocUK @BACP @NHS #IAPT,2026-04-18 05:51:00-05:00,"(91, 0, 1, 1)",betterhelp since:2026-02-01
Why have counsellors been linked into unsafe therapy apps and crisis text lines? @BetterHelp @EAPA_UK @TeladocUK @BACP @NHS #IAPT,2026-04-18 05:48:00-05:00,"(90, 0, 1, 1)",betterhelp since:2026-02-01
"Commodifying mental health: apps, care and profitability Apps claim to improve our mental health – but maybe their business models should be making us anxious all over again. Eoin Fullam looks behind the scenes. revsoc21.uk/2025/04/08/commo…",2026-04-18 02:43:00-05:00,"(119, 0, 1, 2)",betterhelp since:2026-02-01
Why have counsellors been linked into unsafe therapy apps and crisis text lines? @BetterHelp @EAPA_UK @TeladocUK @BACP @NHS #IAPT,2026-04-18 02:39:00-05:00,"(115, 0, 1, 1)",betterhelp since:2026-02-01
"Have you tried the BetterHelp app? You can align with someone you like, they'll cater to your style",2026-04-18 02:09:00-05:00,"(19, 0, 0, 0)",betterhelp since:2026-02-01
"Doc in a box online. Now you can get Mental Health care online it's like a drive thru clinic, you can get drugs but not cured. Betterhelp, Hims, or Her's are no help at all. piped.video/watch?v=uKVNiMvB…",2026-04-17 21:47:00-05:00,"(60, 1, 1, 1)",betterhelp since:2026-02-01
"Good for her yet here you are thrashing about and rampaging that it's power scaling. @betterhelp Help them, please. I didn't say anything about what Hickman/Ewing contributed but this person thinks they're actually making a point. Call the paddy wagon for this bitch.",2026-04-17 21:31:00-05:00,"(30, 0, 0, 0)",betterhelp since:2026-02-01
yea i have got to go to therapy because i need my bitch back.. i genuinely feel like i ruined the best thing i’ve ever had and will ever have because i’m self destructive and overly critical.. i need a betterhelp coupon link stat,2026-04-17 20:53:00-05:00,"(67, 0, 0, 0)",betterhelp since:2026-02-01
Do you need help finding therapy? I’m not sponsored by BetterHelp but I’ve heard good things about it.,2026-04-17 18:43:00-05:00,"(127, 2, 1, 0)",betterhelp since:2026-02-01
He also got psychiatric data from BetterHelp they fined BetterHelp but only a tiny amount.,2026-04-17 17:03:00-05:00,"(125, 2, 0, 0)",betterhelp since:2026-02-01
hmmmm boss. better call tencent betterhelp,2026-04-17 16:20:00-05:00,"(5, 0, 0, 0)",betterhelp since:2026-02-01
are Lola blankets the new betterhelp bc why does literally every person have a code for 50% off,2026-04-17 16:07:00-05:00,"(77, 1, 0, 0)",betterhelp since:2026-02-01
"just think the site ought to drop user created as a whole. it's one of those sponsors I see regularly that bugs me, like betterhelp but not anywhere near as immoral",2026-04-17 13:38:00-05:00,"(27, 2, 1, 0)",betterhelp since:2026-02-01
Imma sign it up for a BetterHelp account and see what happens 😂,2026-04-17 13:00:00-05:00,"(567, 3, 1, 0)",betterhelp since:2026-02-01
the concept of lestat doing a betterhelp ad,2026-04-17 12:01:00-05:00,"(64, 2, 1, 0)",betterhelp since:2026-02-01
BetterHelp: Dark Commercial Patterns And Billing Errors Explained theartistryofglorifiedbullsh…,2026-04-17 12:01:00-05:00,"(37, 1, 1, 1)",betterhelp since:2026-02-01
How did you explain the IAPT and EAPA BetterHelp sponsorships ?,2026-04-17 11:59:00-05:00,"(54, 1, 1, 1)",betterhelp since:2026-02-01
"I don’t know if it’s lazy editors or greedy ad people, but they’ve GOTTA stop throwing the ad reads in at random spots in a podcast. I’m going to need a lot more than betterhelp if another god damned story gets interrupted.",2026-04-17 11:18:00-05:00,"(50, 3, 1, 0)",betterhelp since:2026-02-01
omg ikr ive gotten so many of these ads also betterhelp 😭😭😭,2026-04-17 11:02:00-05:00,"(65, 2, 0, 0)",betterhelp since:2026-02-01
i am going to scream if i get another betterhelp ad.,2026-04-17 10:58:00-05:00,"(112, 2, 1, 0)",betterhelp since:2026-02-01
BETTERHELP he’d shut that service down in 2 months,2026-04-17 10:34:00-05:00,"(13, 1, 0, 0)",betterhelp since:2026-02-01
hellofresh betterhelp,2026-04-17 10:11:00-05:00,"(205, 6, 2, 0)",betterhelp since:2026-02-01
"Hey, not sure if you have a therapist thought I'd share @DammitBits I've been using the therapy service BetterHelp and I wanted to spread the word. Use this link for two free weeks: betterhelp.com/rpc/3dc82c12f…",2026-04-17 09:22:00-05:00,"(36, 0, 0, 0)",betterhelp since:2026-02-01
UK told its Big Tech habit is now a national security risk theregister.com/2026/04/15/u…,2026-04-17 09:19:00-05:00,"(184, 0, 1, 0)",betterhelp since:2026-02-01
"If you like this make sure you follow me at @ArtEddy3 Make sure you download and subscribe to my #podcast, The Art of Fatherhood and check out my site over at artoffatherhood.net. #FridayFeeling #fatherhood #FatherhoodFriday",2026-04-17 08:59:00-05:00,"(183, 10, 0, 6)",betterhelp since:2026-02-01
Dad Joke of the week! #dadjokes #dadjoke #fridayhumor #parenting #fatherhood Why did the bicycle fall over? Because it was two-tired,2026-04-17 08:58:00-05:00,"(139, 6, 1, 6)",betterhelp since:2026-02-01
@FitzMagic_14 @NBAonPrime @RSherman_25 @StateFarm @progressive @AllAmericanRoof @Tubi @PlutoTV @AmazonAlexa @JColeNC @LarryJuneTFM @betterhelp @rihanna @TheBocaRaton @NICKIMINAJ @Drake @AmazonMGMStudio @2chainz @esnyinc @jackblack welcome! You are a cast stoner!,2026-04-17 08:06:00-05:00,"(44, 0, 1, 0)",betterhelp since:2026-02-01
Log off X and log into @betterhelp,2026-04-17 06:50:00-05:00,"(30, 1, 0, 0)",betterhelp since:2026-02-01
@betterhelp,2026-04-17 06:08:00-05:00,"(13, 0, 0, 0)",betterhelp since:2026-02-01
I have been using the therapy service BetterHelp and I think you'd benefit from it too. Get 1 free week if you sign up using this link: betterhelp.com/rpc/2620f16ad…,2026-04-16 23:33:00-05:00,"(5, 0, 0, 0)",betterhelp since:2026-02-01
I have been using the therapy service BetterHelp and I think you'd benefit from it too. Get 1 free week if you sign up using this link: betterhelp.com/rpc/2620f16ad…,2026-04-16 23:32:00-05:00,"(9, 0, 0, 0)",betterhelp since:2026-02-01
lestat x betterhelp brand deal next oouuu,2026-04-16 21:52:00-05:00,"(21, 0, 0, 0)",betterhelp since:2026-02-01
Join betterhelp with code VAMPLESTAT for 69% off your first session!,2026-04-16 21:51:00-05:00,"(180, 9, 0, 0)",betterhelp since:2026-02-01
