tweet,date,stats,query
The Emotional Reset #emotionalreset #betterhelp #mentalhealth #mentalhealthtips,2026-04-22 11:00:00-05:00,"(0, 0, 0, 0)",betterhelp since:2026-02-01
Iggy really about to go from Finals MVP to podcast host to head coach without ever running a single sprint 😭 bro gonna draw up plays between ad reads for BetterHelp 🎙️ Warriors huddle finna start with let me tell you a quick story 👴,2026-04-22 10:10:00-05:00,"(18, 2, 0, 0)",betterhelp since:2026-02-01
Putting Yourself In A Necessary Time-out. Remember when the time-out trend was popular? I teamed up with @betterhelp to take a look at why parents might need to put themselves in a time-out. artoffatherhood.net/putting-… #fatherhood #parenting #timeout #mentalhealth #care,2026-04-22 09:33:00-05:00,"(86, 6, 0, 5)",betterhelp since:2026-02-01
The vast majority of Americans hate podcasters who do nothing but giggle like school girls over the horrors of the world while selling them BetterHelp therapy that doesn't work. Fucking fake ass bitch.,2026-04-22 08:40:00-05:00,"(25, 0, 0, 0)",betterhelp since:2026-02-01
"That one youtuber youre unsure needed to take that betterhelp sponsor for their own livelihood, or pure greed.",2026-04-22 08:18:00-05:00,"(26, 0, 0, 0)",betterhelp since:2026-02-01
Spotify premium was RIPPED from my fingertips yesterday so on my first day of spotify free i was just listening to twenty one pilots n got a betterhelp ad 💔,2026-04-22 06:25:00-05:00,"(87, 3, 1, 0)",betterhelp since:2026-02-01
J'ai bénéficié du service de thérapie BetterHelp et je pense que vous en tirerez également profit. Obtenez une semaine gratuite en vous inscrivant à l'aide de ce lien : betterhelp.com/rpc/c51b5264a…,2026-04-22 03:41:00-05:00,"(3, 0, 0, 0)",betterhelp since:2026-02-01
they’re all shilling “BetterHelp”,2026-04-22 03:34:00-05:00,"(21, 1, 0, 0)",betterhelp since:2026-02-01
"If one of y’all come up with @betterhelp for AI agents, I’d flip out fs.",2026-04-22 00:45:00-05:00,"(34, 0, 0, 0)",betterhelp since:2026-02-01
"Clean hit btw But also, seek help at @betterhelp you psychopath",2026-04-22 00:25:00-05:00,"(4, 0, 0, 0)",betterhelp since:2026-02-01
"CalmBridge. $10 mental health consultations for 18-25 year olds, powered by AI screening and real therapist matching. BetterHelp charges $300/mo. This charges $10. calmbridge.polsia.app",2026-04-21 22:15:00-05:00,"(14, 0, 0, 0)",betterhelp since:2026-02-01
Linking black femicide to mens mental health like these niggas can’t download betterhelp #addicktion,2026-04-21 20:00:00-05:00,"(1446, 78, 0, 22)",betterhelp since:2026-02-01
It just seemed like in my slight absence the trash hadn’t been taken out in a few weeks so I had to make sure it didn’t overflow anymore 🤷🏽‍♂️,2026-04-21 17:48:00-05:00,"(29, 1, 0, 0)",betterhelp since:2026-02-01
I literally saw this when he said that 😭,2026-04-21 16:51:00-05:00,"(27, 1, 1, 0)",betterhelp since:2026-02-01
Chompy woke up and chose violence. Love to see it,2026-04-21 16:45:00-05:00,"(20, 1, 1, 0)",betterhelp since:2026-02-01
"Varosh, it seems you don't understand joking. Also lmao recommending betterhelp of all things",2026-04-21 15:27:00-05:00,"(71, 0, 1, 0)",betterhelp since:2026-02-01
"🚨 breaking news. Deranged man can’t help himself but comment on someone’s page who doesn’t know he exists … literally won’t even do it for a chance to win $100,000 SEEK HELP",2026-04-21 15:10:00-05:00,"(1089, 0, 0, 0)",betterhelp since:2026-02-01
"Learn to deal with it or don’t, I couldn’t care less. With that being said, I’ll disrespectfully decline your paper thin “offer” Boomer🖕🏽",2026-04-21 15:04:00-05:00,"(114, 0, 2, 0)",betterhelp since:2026-02-01
"Ok fair. But you won’t stop so I get confused. Let’s bet. You $100 to my $100,000 Who comments on the others page first?",2026-04-21 15:00:00-05:00,"(93, 0, 1, 0)",betterhelp since:2026-02-01
Two quick things because I know it’s hard for old fucks like yourself to use the internet: 1. This is a post on MY page that you’re commenting on you tweaker 😬😭 2. You literally quote tweeted a tweet from MY page that I commented on and you deleted responses from so who’s obsessed with who Stevie boy? 🏡🧠,2026-04-21 14:58:00-05:00,"(117, 3, 2, 0)",betterhelp since:2026-02-01
Yes 100% my work and I got more coming. Also STOP COMMENTING ON MY PAGE YOU OBSESSED PSYCHO,2026-04-21 14:54:00-05:00,"(104, 0, 1, 0)",betterhelp since:2026-02-01
Yo @betterhelp send my boy a promo code. Needs one bad 🤡,2026-04-21 14:01:00-05:00,"(106, 0, 1, 0)",betterhelp since:2026-02-01
Honestly its sad that here betterhelp is probably tye most affordable option,2026-04-21 12:24:00-05:00,"(19, 0, 0, 0)",betterhelp since:2026-02-01
"Realizes you said some dumb shit, then deflects🤣🤣",2026-04-21 12:01:00-05:00,"(32, 0, 0, 0)",betterhelp since:2026-02-01
You are very emotional. Try @betterhelp,2026-04-21 11:58:00-05:00,"(30, 0, 1, 0)",betterhelp since:2026-02-01
Does anyone recommend @betterhelp pay monthly service?,2026-04-21 11:39:00-05:00,"(11, 0, 0, 0)",betterhelp since:2026-02-01
"You don't lack time, you lack focus! #focus #focusonyou #betterhelp",2026-04-21 11:00:00-05:00,"(2, 0, 0, 0)",betterhelp since:2026-02-01
"BetterHelp doesn't actually do good by a lot of people. Literally anyone can sign on to be a ""licensed therapist"". You have a better chance at havin someone to talk to on a forum about the weaponmakings of anarchists. #mde",2026-04-21 10:03:00-05:00,"(80, 0, 0, 0)",betterhelp since:2026-02-01
Beyond NHS Talking Therapies Data Points - Low intensity CBTs own goal michaelj-scott.com/beyond-nh… via @michaeljscott20,2026-04-21 07:49:00-05:00,"(28, 0, 0, 1)",betterhelp since:2026-02-01
Beyond NHS Talking Therapies Data Points - Low intensity CBTs own goal michaelj-scott.com/beyond-nh… via @michaeljscott20,2026-04-21 07:49:00-05:00,"(32, 0, 0, 0)",betterhelp since:2026-02-01
Beyond NHS Talking Therapies Data Points - Low intensity CBTs own goal michaelj-scott.com/beyond-nh… via @michaeljscott20,2026-04-21 07:49:00-05:00,"(27, 0, 0, 0)",betterhelp since:2026-02-01
Beyond NHS Talking Therapies Data Points - Low intensity CBTs own goal michaelj-scott.com/beyond-nh… via @michaeljscott20,2026-04-21 07:48:00-05:00,"(24, 0, 0, 1)",betterhelp since:2026-02-01
"""Wealthy Exclusive Brethren schools net almost $30m in disadvantage payments. The sect bans most women from paid work and restricts university attendance, insiders claim, and this has an unexpected benefit for network of aligned schools."" theguardian.com/australia-ne…",2026-04-21 07:31:00-05:00,"(41, 0, 1, 0)",betterhelp since:2026-02-01
"""Wealthy Exclusive Brethren schools net almost $30m in disadvantage payments. The sect bans most women from paid work and restricts university attendance, insiders claim, and this has an unexpected benefit for network of aligned schools."" theguardian.com/australia-ne…",2026-04-21 07:31:00-05:00,"(54, 0, 1, 0)",betterhelp since:2026-02-01
"""Wealthy Exclusive Brethren schools net almost $30m in disadvantage payments. The sect bans most women from paid work and restricts university attendance, insiders claim, and this has an unexpected benefit for network of aligned schools."" theguardian.com/australia-ne…",2026-04-21 07:30:00-05:00,"(55, 0, 1, 0)",betterhelp since:2026-02-01
@betterhelp he needs you now more than ever,2026-04-21 07:30:00-05:00,"(9, 0, 0, 0)",betterhelp since:2026-02-01
"""Wealthy Exclusive Brethren schools net almost $30m in disadvantage payments. The sect bans most women from paid work and restricts university attendance, insiders claim, and this has an unexpected benefit for network of aligned schools."" theguardian.com/australia-ne…",2026-04-21 07:30:00-05:00,"(38, 0, 1, 0)",betterhelp since:2026-02-01
"""Wealthy Exclusive Brethren schools net almost $30m in disadvantage payments. The sect bans most women from paid work and restricts university attendance, insiders claim, and this has an unexpected benefit for network of aligned schools."" theguardian.com/australia-ne…",2026-04-21 07:30:00-05:00,"(48, 0, 1, 0)",betterhelp since:2026-02-01
Joe is busy recording ads for things he only uses himself like Betterhelp and Call of Duty so he can get more money that he does not need.,2026-04-21 06:11:00-05:00,"(438, 0, 0, 0)",betterhelp since:2026-02-01
comment en 2026 tu peux encore faire des partenariats betterhelp sérieux,2026-04-21 03:46:00-05:00,"(349, 1, 1, 2)",betterhelp since:2026-02-01
Seek help at @betterhelp No one acts like this loser,2026-04-21 00:28:00-05:00,"(79, 1, 0, 0)",betterhelp since:2026-02-01
I’m gonna try BetterHelp tomorrow to try to get my shit together😕,2026-04-20 21:40:00-05:00,"(52, 0, 0, 0)",betterhelp since:2026-02-01
"IN THE TOP OF THIS IMAGE PRINCE WILLIAM @KensingtonRoyal IN HIS ALIEN FORM I PUT MARYLIN DOWN RECENTLY THERE TREVOR @TrevorLabs, WILLIAM @KensingtonRoyal AND 4 OTHER CONTINUE TO OPERATE ALIEN HQ THAT IS ALSO FACEBOOK META @Meta CHAT A.I. (META A.I.) FIND HELP AT @betterhelp",2026-04-20 19:48:00-05:00,"(48, 0, 0, 0)",betterhelp since:2026-02-01
Of course Bettersleep is owned by the same people behind Betterhelp. The free sound I use to stay calm and sleep for so many years is now behind a paywall.,2026-04-20 19:28:00-05:00,"(19, 0, 0, 0)",betterhelp since:2026-02-01
you tagging better help is fmu😭😭😭,2026-04-20 17:50:00-05:00,"(347, 2, 0, 0)",betterhelp since:2026-02-01
omg like it's not even funny but i'm weak asf bc genuinely everyone is scared asf on all sides😭,2026-04-20 17:50:00-05:00,"(347, 0, 0, 0)",betterhelp since:2026-02-01
@betterhelp found a customer,2026-04-20 17:48:00-05:00,"(89, 2, 0, 0)",betterhelp since:2026-02-01
Like it truly gets to a point and she’s like way beyond that !! She may need to be put in a straight jacket,2026-04-20 17:26:00-05:00,"(632, 7, 0, 0)",betterhelp since:2026-02-01
literally what are u even saying.,2026-04-20 17:18:00-05:00,"(352, 18, 0, 0)",betterhelp since:2026-02-01
she needs help fr,2026-04-20 17:18:00-05:00,"(753, 8, 0, 0)",betterhelp since:2026-02-01
"I stand, and poke my anus out everso slightly as to expose its most intimate nature. But the guy on @betterhelp said its not gay if its MY anus. so.",2026-04-20 17:17:00-05:00,"(44, 0, 0, 0)",betterhelp since:2026-02-01
I’m SCARED,2026-04-20 17:15:00-05:00,"(738, 5, 0, 0)",betterhelp since:2026-02-01
pls she’s scaring everyone on the tl. like seriously im scared. @betterhelp,2026-04-20 17:13:00-05:00,"(5588, 86, 6, 7)",betterhelp since:2026-02-01
Good luck psycho.,2026-04-20 15:23:00-05:00,"(11, 0, 0, 0)",betterhelp since:2026-02-01
I don’t need your sympathy. You give many fucks because you’re still responding in this angry way. @betterhelp can’t even help you. What a sad person you are. Yikes,2026-04-20 15:06:00-05:00,"(21, 0, 1, 0)",betterhelp since:2026-02-01
@FitzMagic_14 @NBAonPrime @RSherman_25 @StateFarm @progressive @AllAmericanRoof @Tubi @PlutoTV @AmazonAlexa @JColeNC @LarryJuneTFM @betterhelp @rihanna @TheBocaRaton @NICKIMINAJ @Drake @AmazonMGMStudio @2chainz @esnyinc @jackblack welcome! You are a cast stoner!,2026-04-20 12:06:00-05:00,"(34, 0, 1, 0)",betterhelp since:2026-02-01
@FitzMagic_14 @NBAonPrime @RSherman_25 @StateFarm @progressive @AllAmericanRoof @Tubi @PlutoTV @AmazonAlexa @JColeNC @LarryJuneTFM @betterhelp @rihanna @TheBocaRaton @NICKIMINAJ @Drake @AmazonMGMStudio @2chainz @esnyinc @jackblack welcome! You are a cast stoner!,2026-04-20 12:03:00-05:00,"(37, 0, 1, 0)",betterhelp since:2026-02-01
instagram.com/p/C9INENHJ7SK/,2026-04-20 11:59:00-05:00,"(56, 0, 0, 0)",betterhelp since:2026-02-01
When we get flashbacks to Nate on BetterHelp,2026-04-20 11:42:00-05:00,"(436, 2, 0, 0)",betterhelp since:2026-02-01
if you’re hating on this lady atp that’s just your personality disorder talking — try betterhelp or benzos 🫶🏼,2026-04-20 11:27:00-05:00,"(2664, 99, 0, 9)",betterhelp since:2026-02-01
"You mastered looking okay, not being okay.. #youarenotokay #betterhelp #motivational",2026-04-20 11:00:00-05:00,"(3, 0, 0, 0)",betterhelp since:2026-02-01
"Posting this here coz you deleted but contact your GP if you can. If you can't go outside there are online therapy sessions (Betterhelp is one). Obvs if you feel things ramping up, call 111 💙",2026-04-20 10:51:00-05:00,"(178, 1, 1, 0)",betterhelp since:2026-02-01
Go get you a betterhelp coupon and go to talk therapy if other people being “ungrateful” for their chronic pain is causing you such emotional distress. Jesus Christ.,2026-04-20 10:47:00-05:00,"(43, 0, 1, 0)",betterhelp since:2026-02-01
"This week's Art of Fatherhood podcast is with Chip Leighton We talk fatherhood, his new book, Dad Can You Not? from @countrymanpress & more. Thanks to @betterhelp for sponsoring this week's episode. artoffatherhood.net/chip-lei… #fatherhood #newbook #author #family #dadjokes @wwnorton",2026-04-20 09:51:00-05:00,"(165, 10, 0, 6)",betterhelp since:2026-02-01
go on betterhelp dot com tell em you’re schizophrenic,2026-04-20 07:34:00-05:00,"(41, 3, 1, 0)",betterhelp since:2026-02-01
"""Tech Billionaires Want Christians to Believe in AI. For Peter Thiel and JD Vance allies, the tech right is framing AI as a moral—even divine—mission."" motherjones.com/politics/202…",2026-04-20 05:52:00-05:00,"(50, 0, 1, 0)",betterhelp since:2026-02-01
"""Tech Billionaires Want Christians to Believe in AI. For Peter Thiel and JD Vance allies, the tech right is framing AI as a moral—even divine—mission."" motherjones.com/politics/202…",2026-04-20 05:52:00-05:00,"(51, 0, 1, 0)",betterhelp since:2026-02-01
"""Tech Billionaires Want Christians to Believe in AI. For Peter Thiel and JD Vance allies, the tech right is framing AI as a moral—even divine—mission."" motherjones.com/politics/202…",2026-04-20 05:52:00-05:00,"(53, 0, 1, 0)",betterhelp since:2026-02-01
"""Tech Billionaires Want Christians to Believe in AI. For Peter Thiel and JD Vance allies, the tech right is framing AI as a moral—even divine—mission."" motherjones.com/politics/202…",2026-04-20 05:52:00-05:00,"(48, 0, 1, 0)",betterhelp since:2026-02-01
"""A broker with the insurance company, Crombie Lockwood, said he was instructed to use a special code with Brethren clients, discounting his commission by 20% which went to the listed ""sub-agency"", UBT (Universal Business Team) a church-controlled company."" rnz.co.nz/news/national/4716…",2026-04-20 05:44:00-05:00,"(66, 0, 1, 0)",betterhelp since:2026-02-01
"""A broker with the insurance company, Crombie Lockwood, said he was instructed to use a special code with Brethren clients, discounting his commission by 20% which went to the listed ""sub-agency"", UBT (Universal Business Team) a church-controlled company."" rnz.co.nz/news/national/4716…",2026-04-20 05:44:00-05:00,"(63, 0, 1, 0)",betterhelp since:2026-02-01
"""A broker with the insurance company, Crombie Lockwood, said he was instructed to use a special code with Brethren clients, discounting his commission by 20% which went to the listed ""sub-agency"", UBT (Universal Business Team) a church-controlled company."" rnz.co.nz/news/national/4716…",2026-04-20 05:44:00-05:00,"(38, 0, 1, 0)",betterhelp since:2026-02-01
"""A broker with the insurance company, Crombie Lockwood, said he was instructed to use a special code with Brethren clients, discounting his commission by 20% which went to the listed ""sub-agency"", UBT (Universal Business Team) a church-controlled company."" rnz.co.nz/news/national/4716…",2026-04-20 05:44:00-05:00,"(46, 0, 1, 0)",betterhelp since:2026-02-01
"""A broker with the insurance company, Crombie Lockwood, said he was instructed to use a special code with Brethren clients, discounting his commission by 20% which went to the listed ""sub-agency"", UBT (Universal Business Team) a church-controlled company."" rnz.co.nz/news/national/4716…",2026-04-20 05:44:00-05:00,"(36, 0, 1, 0)",betterhelp since:2026-02-01
"""A broker with the insurance company, Crombie Lockwood, said he was instructed to use a special code with Brethren clients, discounting his commission by 20% which went to the listed ""sub-agency"", UBT (Universal Business Team) a church-controlled company."" rnz.co.nz/news/national/4716…",2026-04-20 05:43:00-05:00,"(69, 0, 1, 0)",betterhelp since:2026-02-01
Exclusive Brethren told to 'create a crisis' to generate profits thepost.co.nz/nz-news/350113…,2026-04-20 05:03:00-05:00,"(55, 0, 1, 0)",betterhelp since:2026-02-01
Exclusive Brethren told to 'create a crisis' to generate profits thepost.co.nz/nz-news/350113…,2026-04-20 05:03:00-05:00,"(32, 0, 1, 0)",betterhelp since:2026-02-01
Exclusive Brethren told to 'create a crisis' to generate profits thepost.co.nz/nz-news/350113…,2026-04-20 05:02:00-05:00,"(54, 0, 1, 0)",betterhelp since:2026-02-01
Exclusive Brethren told to 'create a crisis' to generate profits thepost.co.nz/nz-news/350113…,2026-04-20 04:59:00-05:00,"(34, 0, 1, 0)",betterhelp since:2026-02-01
Exclusive Brethren told to 'create a crisis' to generate profits thepost.co.nz/nz-news/350113…,2026-04-20 04:58:00-05:00,"(46, 0, 1, 0)",betterhelp since:2026-02-01
Exclusive Brethren told to 'create a crisis' to generate profits thepost.co.nz/nz-news/350113…,2026-04-20 04:58:00-05:00,"(40, 0, 1, 0)",betterhelp since:2026-02-01
The Future of Therapy - Research About The 'Uberization' of Mental Health Services thefutureoftherapy.org/,2026-04-20 04:35:00-05:00,"(54, 0, 1, 0)",betterhelp since:2026-02-01
Podcast ad spending just hit the highest Q1 on record. Top 10 advertisers spent $132.8M. BetterHelp alone: $20M in three months. The ad dollars aren't disappearing. They're finding the creators who actually move product.,2026-04-20 03:00:00-05:00,"(40, 0, 0, 0)",betterhelp since:2026-02-01
The Future of Therapy - Research About The 'Uberization' of Mental Health Services thefutureoftherapy.org/,2026-04-20 02:54:00-05:00,"(93, 0, 1, 0)",betterhelp since:2026-02-01
Between DraftKings and BetterHelp,2026-04-20 00:50:00-05:00,"(109, 0, 0, 0)",betterhelp since:2026-02-01
"Go finish getting cooked by @TalentOverHype , also start with betterhelp. This is a mental illness (not an ad)",2026-04-19 21:55:00-05:00,"(19, 0, 1, 0)",betterhelp since:2026-02-01
So depressed i got an ad for betterhelp and genuinely filled out the entire questionnaire and then had a moment of realization and stopped,2026-04-19 18:12:00-05:00,"(115, 10, 1, 0)",betterhelp since:2026-02-01
"Hahahahaha, who said anything about being black? I think you need to give a therapist a call, you really need it. BetterHelp doesn’t require insurance if that’s something you’re worried about.",2026-04-19 17:25:00-05:00,"(14, 0, 0, 0)",betterhelp since:2026-02-01
@FitzMagic_14 @NBAonPrime @RSherman_25 @StateFarm @progressive @AllAmericanRoof @Tubi @PlutoTV @AmazonAlexa @JColeNC @LarryJuneTFM @betterhelp @rihanna @TheBocaRaton @NICKIMINAJ @Drake @AmazonMGMStudio @2chainz @esnyinc @jackblack welcome! You are a cast stoner!,2026-04-19 13:31:00-05:00,"(25, 0, 1, 0)",betterhelp since:2026-02-01
@FitzMagic_14 @NBAonPrime @RSherman_25 @StateFarm @progressive @AllAmericanRoof @Tubi @PlutoTV @AmazonAlexa @JColeNC @LarryJuneTFM @betterhelp @rihanna @TheBocaRaton @NICKIMINAJ @Drake @AmazonMGMStudio @2chainz @esnyinc @jackblack welcome! You are a cast stoner!,2026-04-19 13:00:00-05:00,"(20, 0, 1, 0)",betterhelp since:2026-02-01
"BetterHelp is hiring Senior Database Engineer — Remote Up to $180K Own Aurora MySQL clusters, tuning Laravel/Eloquent queries and designing scalable schemas. Link in reply. #database #mysql #aws",2026-04-19 12:56:00-05:00,"(33, 0, 2, 0)",betterhelp since:2026-02-01
@FitzMagic_14 @NBAonPrime @RSherman_25 @StateFarm @progressive @AllAmericanRoof @Tubi @PlutoTV @AmazonAlexa @JColeNC @LarryJuneTFM @betterhelp @rihanna @TheBocaRaton @NICKIMINAJ @Drake @AmazonMGMStudio @2chainz @esnyinc @jackblack welcome! You are a cast stoner!,2026-04-19 12:26:00-05:00,"(24, 0, 1, 0)",betterhelp since:2026-02-01
she was the blueprint that inspired betterhelp,2026-04-19 12:05:00-05:00,"(57, 3, 0, 0)",betterhelp since:2026-02-01
"BetterHelp: Dark Commercial Patterns and Billing Errors Explained. ""The system was designed with major flaws which allow the company to syphon money."" theartistryofglorifiedbullsh…",2026-04-19 09:00:00-05:00,"(5, 0, 0, 0)",betterhelp since:2026-02-01
NEW EPISODE ALERT! Join us today as we take a look at the case of Mackenzie Shirilla. Available now! #cooldownbeers #podcast #betterhelp,2026-04-19 08:31:00-05:00,"(911, 10, 1, 3)",betterhelp since:2026-02-01
"Somebody ban this fucking betterhelp and let me watch my video. Dont you fucking get it video is my only therapy, thats the only cheapest way i can get my therapy and you come inbetween distrupting me telling why am i avoiding help?! man fuck off trynna piss me beg moneyonstreet",2026-04-19 08:06:00-05:00,"(8, 0, 0, 0)",betterhelp since:2026-02-01
Sequel but this time the villain isn’t a demon but BetterHelp ads,2026-04-19 07:28:00-05:00,"(99, 1, 0, 0)",betterhelp since:2026-02-01
i’m scrolling through tiktok going through lingorms situationship era and every other ad is for betterhelp telling me to get a therapist…what’s that supposed to mean?,2026-04-19 07:20:00-05:00,"(661, 27, 1, 3)",betterhelp since:2026-02-01
freezai sponsored betterhelp and deleted comments calling it out so theres a reason to hate him 😍,2026-04-19 07:01:00-05:00,"(56, 1, 0, 0)",betterhelp since:2026-02-01
The IAPT Service Is an Abject Failure madintheuk.com/2022/09/iapt-… via @MITUKTeam @michaeljscott20,2026-04-19 05:02:00-05:00,"(48, 0, 1, 0)",betterhelp since:2026-02-01
The IAPT Service Is an Abject Failure madintheuk.com/2022/09/iapt-… via @MITUKTeam @michaeljscott20,2026-04-19 05:01:00-05:00,"(65, 0, 1, 0)",betterhelp since:2026-02-01
The IAPT Service Is an Abject Failure madintheuk.com/2022/09/iapt-… via @MITUKTeam @michaeljscott20,2026-04-19 05:00:00-05:00,"(61, 0, 1, 0)",betterhelp since:2026-02-01
The IAPT Service Is an Abject Failure madintheuk.com/2022/09/iapt-… via @MITUKTeam @michaeljscott20,2026-04-19 04:59:00-05:00,"(40, 0, 1, 0)",betterhelp since:2026-02-01
The IAPT Service Is an Abject Failure madintheuk.com/2022/09/iapt-… via @MITUKTeam @michaeljscott20,2026-04-19 04:59:00-05:00,"(48, 0, 1, 0)",betterhelp since:2026-02-01
"Látom, hogy engem targetál a betterhelp nevű oldal, amit én nem ismerek. Én egyáltalán nem szeretnék semmilyen terápiára sem járni, ez nem a pszichiáter személyén múlik. Viszont a gyógyszereket szednem kell, különben lehet, hogy meghalnék, sajnos így maradtam az elmúlt évek során",2026-04-19 04:05:00-05:00,"(4, 0, 2, 0)",betterhelp since:2026-02-01
"If you have clinical issues or trauma, you need a licensed therapist on BetterHelp. If your main issue is how you communicate during fights, paying 30x more for scheduled sessions might not solve the core problem. 4/5",2026-04-19 01:46:00-05:00,"(4, 0, 1, 0)",betterhelp since:2026-02-01
"BetterHelp operates on a schedule. Your session is Thursday at 7 PM. But your worst fights happen on Monday at 10 PM. By the time you talk to a therapist, the damage is already done. 2/5",2026-04-19 01:46:00-05:00,"(7, 0, 1, 0)",betterhelp since:2026-02-01
I spent time comparing the actual use cases for LoveFix and BetterHelp. The biggest difference is not the massive price gap. It is about when the help arrives. 🧵 1/5,2026-04-19 01:46:00-05:00,"(3, 1, 1, 0)",betterhelp since:2026-02-01
"marcus fenix shortly after watching lieutenant kim get split open by locust general pat mcafee's sword: ANYA, i need a betterhelp subscription strike on my mark ASAP!",2026-04-18 22:52:00-05:00,"(3966, 29, 0, 0)",betterhelp since:2026-02-01
"BetterHelp has online therapy. Use it coach. If you need anything, I'm here for you",2026-04-18 21:15:00-05:00,"(52, 2, 0, 1)",betterhelp since:2026-02-01
BetterHelp is to therapy what Duolingo is to learning languages,2026-04-18 20:41:00-05:00,"(14, 0, 0, 0)",betterhelp since:2026-02-01
like i genuinely don’t care about men crying about mental health when it’s the 21st century and by gods if you can’t get insured therapy JUST USE THE BETTERHELP GET A BOOK MEDITATE I DONT KNOW BUT STOP KILLING EVERYONE ELSE,2026-04-18 16:55:00-05:00,"(51, 1, 1, 0)",betterhelp since:2026-02-01
Overworked and Underpaid: UK Therapists Respond to US Online Platform BetterHelp welldoing.org/article/overwo…,2026-04-18 16:24:00-05:00,"(59, 0, 2, 0)",betterhelp since:2026-02-01
so there’s this website called betterhelp,2026-04-18 16:19:00-05:00,"(71, 2, 0, 0)",betterhelp since:2026-02-01
Overworked and Underpaid: UK Therapists Respond to US Online Platform BetterHelp welldoing.org/article/overwo…,2026-04-18 16:18:00-05:00,"(33, 0, 0, 0)",betterhelp since:2026-02-01
Overworked and Underpaid: UK Therapists Respond to US Online Platform BetterHelp welldoing.org/article/overwo…,2026-04-18 16:14:00-05:00,"(12, 1, 0, 1)",betterhelp since:2026-02-01
"Today on LandingRoles: → 1,002 new remote jobs indexed → 262 paying $150K+ → 142 sales · 79 healthcare · 68 operations → Top hiring: Cresta (42), BetterHelp (25), ABC Legal Services (19) → Hottest stack: Salesforce (24 jobs) Browse → #remotejobs #techjobs #hiring",2026-04-18 16:04:00-05:00,"(58, 0, 2, 0)",betterhelp since:2026-02-01
BetterHelp or BetterNot? Ensuring Mental Health Tech Innovation is Psychologically Sound. aaronbalick.com/post/betterh…,2026-04-18 14:31:00-05:00,"(45, 0, 0, 1)",betterhelp since:2026-02-01
guys ive actually been larping the entire time every time i tweet its from my prebuilt pc running ubuntu with GNOME on the website via google chrome in which i have honey installed to get good deals on all my favorite products and i meet weekly with my betterhelp professional,2026-04-18 14:27:00-05:00,"(73, 2, 0, 0)",betterhelp since:2026-02-01
