tweet,date,stats,query
"Curtis is back with another taste test video! This time, he's trying Magic Spoon Cinnamon Roll cereal. Is it worth the price? Tune in to find out! #MagicSpoon #tastetest #breakfast #SnackNetwork Subscribe on YouTube piped.video/@TheSnackNetwork We No Longer Check X",2026-03-29 18:32:00-05:00,"(39, 0, 0, 0)",magic spoon cereal since:2026-02-01
"Magic Spoon is the only cereal I’ve found. If you find something else let me know. Add Fairlife skim milk. It’s a 50g protein breakfast (double serving). The only flavor I’ve tried is fruity, they sell a double box at my Costco.",2026-03-29 10:41:00-05:00,"(446, 3, 0, 0)",magic spoon cereal since:2026-02-01
Have you tried the protein cereal magic spoon? Might be a better option,2026-03-29 09:57:00-05:00,"(8, 1, 1, 0)",magic spoon cereal since:2026-02-01
Last weekend my local Costco went hard in the paint with a Magic Spoon cereal setup. Next level,2026-03-28 15:11:00-05:00,"(102, 0, 0, 0)",magic spoon cereal since:2026-02-01
"4. ""Magic Spoon"" protein cereal 150 calories 13g protein Hack: instead of regular milk you can use vanilla fairlife and boost the macro profile significantly.",2026-03-10 08:06:00-05:00,"(2178, 3, 1, 0)",magic spoon cereal since:2026-02-01
the magic spoon cereal bars are SO GOOD they're my new gas station snack,2026-04-22 08:52:00-05:00,"(59, 1, 1, 0)",magic spoon cereal since:2026-02-01
"In an effort to combat yesterday's outrageous amount of Junk Food Intake: Three Wishes Protein Cereal w/ Fairlife Whole Milk! Ghost Cereal tastes like cardboard, Magic Spoon doesn't have as much Protein. This tastes very close to Cinnamon Toast Crunch! 😋",2026-04-21 14:04:00-05:00,"(23, 0, 0, 0)",magic spoon cereal since:2026-02-01
For the binge eaters of #edtwt .. here are some carb swaps to consider Carb control tortillas Egglife eggwhite wrap L’oven Keto bread Magic spoon cereal Katalina crunch cereal Ghost cereal Almond milk Cauliflower rice and lastly.. ❗️0sugar version of any sweets❗️ Pt.1 ^^,2026-04-20 20:11:00-05:00,"(29, 1, 0, 1)",magic spoon cereal since:2026-02-01
Counterpoint: I sort of like when people try to make better versions of shitty junk food. Fruit loops version of magic spoon cereal is killer,2026-04-19 17:48:00-05:00,"(23, 1, 1, 0)",magic spoon cereal since:2026-02-01
tim dillon used to do funny ass magic spoon ads back in the day...i think it was magic spoon cereal...that shit bangin like that?i like ya goofy laugh at te end,2026-04-15 23:05:00-05:00,"(139, 2, 0, 0)",magic spoon cereal since:2026-02-01
"Magic spoon protein cereal is the biggest hack oat for snacking. 65g of protein per box w zero added sugar and gluten free, tastes exactly like fruit loops",2026-04-15 21:40:00-05:00,"(119, 0, 0, 0)",magic spoon cereal since:2026-02-01
"I absolutely devoured it before I took a picture but 1 container of yogurt (I used coconut Siggis for 150 cals), 1/4th cup of Magic Spoon fruity cereal (37.5 calories), and 1 Kodiak cinnamon french toast stick (82.5 calories) is amazing and I’ve been influenced",2026-04-14 17:41:00-05:00,"(191, 0, 0, 0)",magic spoon cereal since:2026-02-01
"""what's up you absolute legends. Today we're going to take a look at the fastest speedrunning attempts to lose a court case. And stick around until the end, where I've left my own attempt in this category."" ""But first, have you ever tried cereal? Today's sponsor is magic spoon.""",2026-04-09 13:24:00-05:00,"(120, 3, 0, 0)",magic spoon cereal since:2026-02-01
"I don’t recommend any of those cereals. I don’t even eat cereal at all. I eat REAL American breakfast like eggs, sausage, bacon, and pancakes. But if I had to choose at gun point, it’ll be Magic Spoon, especially the fruity flavor since it reminds me of froot loops",2026-04-08 14:46:00-05:00,"(20, 0, 0, 0)",magic spoon cereal since:2026-02-01
9. protein bars ‣ magic spoon marshmallow cereal bar (130 cal) ‣ alani nu caramel crunch bar (190 cal) ‣ barebells creamy crisp bar (200 cal) ‣ legendary protein pastry or donuts (180 cal),2026-04-08 01:15:00-05:00,"(2002, 15, 1, 0)",magic spoon cereal since:2026-02-01
Man it’s wild how much the Magic Spoon cereal tastes exactly like the stuff we had as kids.,2026-04-07 08:15:00-05:00,"(52, 1, 0, 0)",magic spoon cereal since:2026-02-01
"Yes. Try a Magic Spoon chocolate cereal bar. Low carb, high fiber, no soy, high protein. Fabulously crunchy. Way better than Rice Krispy treats.",2026-04-05 21:10:00-05:00,"(39, 1, 0, 0)",magic spoon cereal since:2026-02-01
"check out magic spoon cereal, if you haven’t",2026-04-04 16:31:00-05:00,"(81, 1, 0, 0)",magic spoon cereal since:2026-02-01
recipe: - 2 dannon light and fit toasted marshmallow yogurt cups - 1 magic spoon protein marshmallow cereal bars - 1/2 legendary cinnamon brown sugar protein pastry - 1/3 cup dark chocolate catalina crunch,2026-04-03 15:06:00-05:00,"(37, 0, 0, 0)",magic spoon cereal since:2026-02-01
What audience? The few people who still watch so the can get a discount on Magic Spoon cereal?,2026-04-03 08:56:00-05:00,"(5, 0, 0, 0)",magic spoon cereal since:2026-02-01
I haven't had those but have you tried Magic Spoon? It's protein cereal and the one they have that looks like Trix tastes EXACTLY like it used to when we were kids. SO good.,2026-04-01 21:38:00-05:00,"(23, 1, 1, 0)",magic spoon cereal since:2026-02-01
"Curtis is back with another taste test video! This time, he's trying Magic Spoon Cinnamon Roll cereal. Is it worth the price? Tune in to find out! #MagicSpoon #tastetest #breakfast #SnackNetwork Subscribe on YouTube piped.video/@TheSnackNetwork We No Longer Check X",2026-03-29 18:32:00-05:00,"(39, 0, 0, 0)",magic spoon cereal since:2026-02-01
"Magic Spoon is the only cereal I’ve found. If you find something else let me know. Add Fairlife skim milk. It’s a 50g protein breakfast (double serving). The only flavor I’ve tried is fruity, they sell a double box at my Costco.",2026-03-29 10:41:00-05:00,"(446, 3, 0, 0)",magic spoon cereal since:2026-02-01
Have you tried the protein cereal magic spoon? Might be a better option,2026-03-29 09:57:00-05:00,"(8, 1, 1, 0)",magic spoon cereal since:2026-02-01
"Weekend vibes hitting different: Spoon-deep in cereal, plotting a full life glow-up like it's no big deal. New job? Gym god? World traveler? All queued up between bites of crunchy goodness. Why drag it to Monday when your Saturday spoon says ""seize the day""? Pro tip: Add rainbow sprinkles for extra magic. Who's with me? 😂🥣✨ #CerealRevolution #LifeHackBreakfast #WeekendPlans #Procrastination #jjillend",2026-03-28 20:58:00-05:00,"(12, 0, 0, 0)",magic spoon cereal since:2026-02-01
Google LMNT and buy it. Ironically enough... drink less water particularly before bed. Drinking a lot of water actually lowers the level of electrolytes in your blood.,2026-04-22 10:52:00-05:00,"(6, 1, 0, 0)",LMNT since:2026-02-01
"I use LMNT. It’s an electrolyte drink made of sodium potassium and magnesium salts. I would wake up with horrible leg cramps screaming in pain and I’d go for a banana and pickle juice and that seemed to help after 10 or 20 minutes. You might know that banana and pickle juice contains sodium, magnesium and potassium.. Now I supplement with element, sometimes before bed or keep a premix on my nightstand.",2026-04-22 10:42:00-05:00,"(253, 1, 0, 0)",LMNT since:2026-02-01
Try some hydration powder and add to your water - LMNT or NativePath are good ones.,2026-04-22 10:33:00-05:00,"(1, 0, 0, 0)",LMNT since:2026-02-01
I made my own by copying LMNT but with like 90% less NaCl and I use like 1/4th the serving size.,2026-04-22 09:19:00-05:00,"(4, 0, 0, 0)",LMNT since:2026-02-01
Lmnt. Or drink more salts. Electrolytes.,2026-04-22 08:52:00-05:00,"(7, 0, 0, 0)",LMNT since:2026-02-01
Supplement with proper electrolytes. I prefer SALTT and LMNT.,2026-04-22 08:01:00-05:00,"(4, 0, 0, 0)",LMNT since:2026-02-01
"I used to use LMNT, recently just been adding salt and half a lemon squeezed to 500ml Feels fresh in the AM",2026-04-22 07:01:00-05:00,"(48, 1, 0, 0)",LMNT since:2026-02-01
"My Entry for LMNT CREATOR'S CAMPAIGN Web3 belongs to creators, but technical barriers act as gatekeepers. This video explores how @LaunchMyNFT eliminates the need for coding, allowing artists to stop fighting the technology and focus on building their legacy. #LMNFTCreate",2026-04-22 05:34:00-05:00,"(77, 1, 1, 1)",LMNT since:2026-02-01
"Derin, or home make electrolytes like lmnt",2026-04-22 05:24:00-05:00,"(4, 0, 0, 0)",LMNT since:2026-02-01
What are the best electrolytes out there? Currently using a mix of Oshun in the AM and then Humantra before/after exercise Used to use LMNT Want to test some others,2026-04-22 05:09:00-05:00,"(1400, 4, 3, 0)",LMNT since:2026-02-01
"LMNT is my top recommendation as it has high sodium, no sugar, great for mineral balance and skin issues.",2026-04-22 00:52:00-05:00,"(245, 2, 0, 0)",LMNT since:2026-02-01
I like LMNT as it’s cheap and easy and travels well. We recycle so i don’t feel guilty about individual packets.,2026-04-21 17:42:00-05:00,"(1, 0, 0, 0)",LMNT since:2026-02-01
Citrus salt LMNT water White mocha Americano Shirley temple Contact solution Hair conditioner because hotels never have good options,2026-04-21 13:51:00-05:00,"(806, 6, 1, 0)",LMNT since:2026-02-01
"in all seriousness, I understand where you're coming from - for competitive athletes. I also know people that pop an LMNT before they go desk jockey for 9 hours and then go home and watch Netflix. That's the point I was making. But I do love a good twitter fingers repartee",2026-04-21 13:33:00-05:00,"(16, 1, 1, 0)",LMNT since:2026-02-01
“Even Gatorade Zero is often discouraged by long-term fasters because the artificial sweeteners can trigger hunger or digestive issues on an empty stomach.” Back to the LMNT,2026-04-21 11:05:00-05:00,"(22, 0, 0, 0)",LMNT since:2026-02-01
"A note on the glory of milk, BHI 1.50-1.58: lactose breaks down at the intestinal brush border into glucose and galactose — both SGLT1 substrates So milk, the nectar of the gods, activates the transporter that LMNT skips",2026-04-21 10:57:00-05:00,"(8, 1, 1, 0)",LMNT since:2026-02-01
"LMNT has higher sodium, no amino acids, and no glucose It almost certainly scores below 1.24 Call it somewhere in the range of 1.05 to 1.15 — maybe ten percent better than water, generously, and some of that is likely the kidneys retaining fluid from the sodium load rather than improved gut absorption Compare that to 54% from a proper ORS, for $3-5/packet Robbery",2026-04-21 10:57:00-05:00,"(19, 0, 1, 0)",LMNT since:2026-02-01
"So where does LMNT sit? We don’t have direct BHI data on it, but we can triangulate This study tested an amino acid + electrolyte solution with 60 mmol/L sodium and no glucose The BHI: 1.24 Better than water, but well short of the 1.5+ seen with glucose-containing ORS pubmed.ncbi.nlm.nih.gov/3105…",2026-04-21 10:57:00-05:00,"(16, 0, 1, 0)",LMNT since:2026-02-01
You can make your own ORS in 30 seconds for a fraction of the price of LMNT and it will work 1.5x better,2026-04-21 10:56:00-05:00,"(8, 0, 1, 0)",LMNT since:2026-02-01
Do you see how absurd that is? How demonstrative this is of marketing over function? This is the case for both LMNT and Kaizen -- who influencer market like crazy (via influencers who don't understand hydration),2026-04-21 10:56:00-05:00,"(11, 0, 1, 0)",LMNT since:2026-02-01
LMNT on the sleeve,2026-04-21 09:44:00-05:00,"(11, 0, 0, 0)",LMNT since:2026-02-01
LMNT 115 - Paradise (Steerner & XanTz Remix) piped.video/O78PgKKbl4c?si=xzFb… @YouTubeより,2026-04-21 02:41:00-05:00,"(80, 0, 0, 0)",LMNT since:2026-02-01
LMNT is cool cos they put their recipe on their site for ppl who want to make their own. That’s what I do.,2026-04-21 01:32:00-05:00,"(12, 0, 0, 0)",LMNT since:2026-02-01
Water laced with LMNT.,2026-04-20 21:06:00-05:00,"(144, 2, 0, 0)",LMNT since:2026-02-01
"0, did used to get LMNT not gonna like, and 0,0,0,0. I have to get something, I had my gallbladder out back in the army and I do not stay hydrated as a result of complications. When I get paid I will likely get another sport drink lol. I do like it, just running out of my first orange. I'll keep a look out for discounts 👍",2026-04-20 14:32:00-05:00,"(22, 1, 1, 0)",LMNT since:2026-02-01
"$40 / 30 = $1.33. (This is before discounts). How much are you spending a day on Monster Energy, LMNT, Gatorade, Coke, Coffee, UberEats and V-Bucks?",2026-04-20 14:27:00-05:00,"(30, 3, 1, 0)",LMNT since:2026-02-01
I created me because I had persisting stomach issues with LMNT.,2026-04-20 14:03:00-05:00,"(1248, 11, 0, 1)",LMNT since:2026-02-01
"every single day needs to have these steps, in this order, or you will fail in life: 1) wake up at 5.30am 2) poop until 5.40am 3) workout at 6am 4) poop again at 6.45am 5) drink LMNT 6) take a shower at 7am 7) breakfast, coffee, waterever until 8am 8) work until noon 9) lunch break 1 hour at noon 10) back to work at 1pm 11) stop working at 5pm 12) fortnite game 5-6pm 13) dinner at 7pm 14) do whatever until 9pm 15) sleep at 9pm",2026-04-20 09:59:00-05:00,"(365, 3, 2, 0)",LMNT since:2026-02-01
आप अपनी बॉडी का नेचर आप खुद चेक करे Is Your Body is Acidic Or Alkaline Nature #Acidicbody #alkalinebody #Bodydiagnosis #bodynature #Nawalsir #Neurotherapist #Neurotherapy #Lmnt,2026-04-20 01:14:00-05:00,"(5, 0, 0, 0)",LMNT since:2026-02-01
"it's just the three main electrolytes the body needs in whatever form you desire. Sodium, Potassium, and Magnesium. I like LMNT as its easy. I have been on LMNT the longest. I also use youngevity's products. Https://youngevity.com/us_en… Https://piped.video/watc…",2026-04-19 20:26:00-05:00,"(34, 0, 0, 0)",LMNT since:2026-02-01
Does sport drink taste like diet chemicals (like LMNT for example),2026-04-19 17:47:00-05:00,"(161, 1, 1, 0)",LMNT since:2026-02-01
LMNT amzn.to/4mHX4aj,2026-04-19 13:40:00-05:00,"(19, 0, 0, 1)",LMNT since:2026-02-01
"Here’s what’s even more amazing: on their own website, they post the directions to make LMNT electrolytes at home using a few simple ingredients. Some might think that this is a huge mistake as people avoid buying the packets and make it themselves for cheaper. But for me, I will continue to buy the packets when I travel or go on bike rides for the convenience in great flavors. By being open and transparent, they have a customer for life. science.drinklmnt.com/electr…",2026-04-19 13:34:00-05:00,"(22, 1, 0, 0)",LMNT since:2026-02-01
"Idk about that one, Mr. Squid…LMNT might not want other beverages involved. And, there’s one small problem with the part about @THEREALPUNK being the cuck…👇🏼",2026-04-19 13:28:00-05:00,"(1302, 0, 0, 0)",LMNT since:2026-02-01
Jake Zach and LMNT was left in 2025 little bro,2026-04-19 11:55:00-05:00,"(58, 0, 0, 0)",LMNT since:2026-02-01
Really need some LMNT electrolytes right now,2026-04-19 11:50:00-05:00,"(39, 1, 1, 0)",LMNT since:2026-02-01
Can your lmnt do this?,2026-04-19 11:25:00-05:00,"(788, 9, 0, 1)",LMNT since:2026-02-01
"Hydration is about fluid balance—and that comes down to electrolytes. LMNT was built for this: ✔️ 1000 mg sodium ✔️ 200 mg potassium ✔️ 60 mg magnesium ✔️ Zero sugar, no artificial junk 👉 Get your free Sample Pack with any LMNT drink mix purchase - partners.drinklmnt.com/free-…",2026-04-19 11:18:00-05:00,"(115, 0, 0, 0)",LMNT since:2026-02-01
Thank you @drinkLMNT For the early preview of your new flavors! Lemonade + Iced Tea & Pink Lemonade! These are amazing! I have never accepted Sponsors. LMNT isn’t sponsoring me. I use LMNT every day for years! Can’t recommend enough!,2026-04-19 09:39:00-05:00,"(1706, 26, 4, 0)",LMNT since:2026-02-01
"it's just the three main electrolytes the body needs in whatever form you desire. Sodium, Potassium, and Magnesium. I like LMNT as its easy. I have been on LMNT the longest. I also use youngevity's products. video.youngevity.com/detail/…",2026-04-18 18:04:00-05:00,"(210, 2, 0, 0)",LMNT since:2026-02-01
"it's just the three main electrolytes the body needs in whatever form you desire. Sodium, Potassium, and Magnesium. I like LMNT as its easy. I have been on LMNT the longest. I also use youngevity's products. video.youngevity.com/detail/…",2026-04-18 18:03:00-05:00,"(42, 0, 0, 0)",LMNT since:2026-02-01
"it's just the three main electrolytes the body needs in whatever form you desire. Sodium, Potassium, and Magnesium. I like LMNT as its easy. I have been on LMNT the longest. I also use youngevity's products. video.youngevity.com/detail/…",2026-04-18 16:38:00-05:00,"(92, 0, 0, 0)",LMNT since:2026-02-01
LMNT adds maltodextrin as a flavour carrier and does not list it on the ingredients according to a class action lawsuit. Go for the unflavoured.,2026-04-18 15:00:00-05:00,"(20, 0, 0, 0)",LMNT since:2026-02-01
New LMNT flavors (not sponsored) hit. Pink lemonade especially.,2026-04-18 14:42:00-05:00,"(20578, 219, 29, 7)",LMNT since:2026-02-01
Orange LMNT,2026-04-18 11:26:00-05:00,"(4, 0, 0, 0)",LMNT since:2026-02-01
Would you still recommend LMNT. Obviously heard about maltodextrin but I’m also reading something about black mould lol I obviously done the school boy error on buying something before “tiktok and Twitter research”,2026-04-18 10:52:00-05:00,"(30, 0, 0, 0)",LMNT since:2026-02-01
The Jewish salt water tastes good and is healthy. Other Jews would lie and sell you LMNT.,2026-04-18 09:10:00-05:00,"(16, 0, 0, 0)",LMNT since:2026-02-01
💯 Great that you have a girl that is onboard with being healthy. I have been using Celtic sea salt and supplementing with a product called BUOY. Never heard of LMNT. Will have to check it out,2026-04-18 08:00:00-05:00,"(61, 2, 1, 0)",LMNT since:2026-02-01
One of keys to success in life is Hydration. She recently joined me in the carnivore lifestyle and is realizing how important it is. As for electrolytes — 2 packets of LMNT a day 💥,2026-04-18 07:51:00-05:00,"(93, 6, 1, 0)",LMNT since:2026-02-01
Maybe this is why the carnivore/ keto community is thriving LMNT. SALTR.,2026-04-18 07:44:00-05:00,"(2386, 0, 1, 0)",LMNT since:2026-02-01
"t's just the three main electrolytes the body needs in whatever form you desire. Sodium, Potassium, and Magnesium. I like LMNT as its easy. I have been on LMNT the longest. I also use youngevity's products. video.youngevity.com/detail/… youngevity.com/nz_en/catalog…",2026-04-18 07:12:00-05:00,"(168, 1, 0, 0)",LMNT since:2026-02-01
"t's just the three main electrolytes the body needs in whatever form you desire. Sodium, Potassium, and Magnesium. I like LMNT as its easy. I have been on LMNT the longest. I also use youngevity's products. video.youngevity.com/detail/… youngevity.com/nz_en/catalog…",2026-04-18 04:33:00-05:00,"(180, 3, 1, 0)",LMNT since:2026-02-01
I wholeheartedly suggest you switch to LMNT.,2026-04-17 23:58:00-05:00,"(16, 0, 0, 0)",LMNT since:2026-02-01
Black LMNT 😂,2026-04-17 23:55:00-05:00,"(5, 0, 0, 0)",LMNT since:2026-02-01
I drink LMNT for this very reason and it helps a lot Louis. @drinkLMNT,2026-04-17 20:59:00-05:00,"(249, 4, 0, 1)",LMNT since:2026-02-01
You guys should setup at the @bikenewyork bike tour next month. LMNT is the bomb for bikes.,2026-04-17 19:45:00-05:00,"(6, 0, 0, 0)",LMNT since:2026-02-01
LMNT salt packs really help with mine,2026-04-17 19:25:00-05:00,"(339, 8, 0, 0)",LMNT since:2026-02-01
"It's just the three main electrolytes the body needs in whatever form you desire. Sodium, Potassium, and Magnesium. I like LMNT as its easy. I also use youngevity's products. video.youngevity.com/detail/… youngevity.com/us_en/plant-d…",2026-04-17 18:11:00-05:00,"(158, 4, 0, 1)",LMNT since:2026-02-01
"I don’t think it’s any kind of “thing,” I just tried adding the Chocolate LMNT to my coffee and I hate it.",2026-04-17 16:53:00-05:00,"(7, 1, 0, 0)",LMNT since:2026-02-01
Did anyone else get the new LMNT flavors?! The pink lemonade is so good!!,2026-04-17 16:02:00-05:00,"(61, 0, 0, 0)",LMNT since:2026-02-01
"Pink Lemonade gummies are a family favorite. Ideal for pool days, play dates, and camp coolers. You'll need: ⁠ ⁠ 🍋 1 stick pack LMNT Pink Lemonade⁠ 🍋 1 pint fresh raspberries⁠ 🍋 4 tbsp beef gelatin (or other unflavored gelatin)⁠ 🍋 2 cups water⁠ ⁠ To make Pink Lemonade gummies...",2026-04-17 15:19:00-05:00,"(637, 13, 1, 3)",LMNT since:2026-02-01
"The minimum effective dose for new parents who train (like me) For the worst weeks (first weeks, teething, illness, sleep regression), the floor is: Morning mobility every day (5 minutes) One DadProof Blueprint session (any day) Water + Hydration (LMNT) intake at target One walk with the stroller This is the floor. Holding it during the worst weeks will prevent YOUR regression. The dads who succeed aren't the ones who never miss. They're the ones who protect the minimum and never fully stop.",2026-04-17 11:42:00-05:00,"(46, 0, 0, 0)",LMNT since:2026-02-01
"OK, I got to try a new release that is coming in June. I give it a 9.5. Nothing gets a 10 from me. This is a game changer for those that want a little caffeine with their electrolytes. #lmnt",2026-04-17 11:06:00-05:00,"(5498, 37, 5, 0)",LMNT since:2026-02-01
"Was surprised yesterday when I randomly got a package from @drinkLMNT! I subscribe & love #LMNT! It’s helped me a lot! Don’t drink other brands now, because LMNT tastes great & helps me a lot! I got their NEW Pink Lemonade Salt! Tried it last night - LOVE IT! #ThankYou",2026-04-17 10:55:00-05:00,"(25, 1, 0, 0)",LMNT since:2026-02-01
i bought LMNT zero sugar do u think that’s good?,2026-04-17 10:34:00-05:00,"(20, 0, 1, 0)",LMNT since:2026-02-01
I love this marketing AND customer relations play. Will I buy more LMNT bc of it? 1000%. I love this product. @drinkLMNT,2026-04-17 06:20:00-05:00,"(36, 2, 0, 0)",LMNT since:2026-02-01
"It's just the three main electrolytes the body needs in whatever form you desire. Sodium, Potassium, and Magnesium. I like LMNT as its easy. I also use youngevity's products. video.youngevity.com/detail/… youngevity.com/us_en/plant-d…",2026-04-17 00:18:00-05:00,"(171, 0, 0, 0)",LMNT since:2026-02-01
"total water. it's where I drink 1/2 my total war, dump the rest in my water bottle with an LMNT pack & fill w water.",2026-04-16 20:50:00-05:00,"(41, 1, 1, 0)",LMNT since:2026-02-01
Makes the world go round. Not sure if I get enough in to be honest. I once tried a packet of LMNT and it shot my BP up too high for my liking.,2026-04-16 20:13:00-05:00,"(16, 0, 0, 0)",LMNT since:2026-02-01
"LMNT just sent me and many others 15 free electrolyte sticks. Unprompted. I’m not even a subscriber. Why this is brilliant marketing: 1. Framed as “INSIDER” - I feel chosen, not randomly sent these 2. Two NEW flavors: I become their launch focus group 3. “Enjoy and share” - built-in word of mouth 4. Costs them maybe $10-$15, which is mostly shipping. Doing this across a large amount of customers generates millions of organic impressions. I bet they see a 10x ROI on this. Reward your previous buyers, not just your subscribers. This is brilliant marketing @drinkLMNT",2026-04-16 16:39:00-05:00,"(60, 2, 0, 0)",LMNT since:2026-02-01
Can you mix it with electrolyte drinks like LMNT? I live in a city with 80% humidity and drink that during the day.,2026-04-16 16:22:00-05:00,"(396, 0, 0, 0)",LMNT since:2026-02-01
Hey @drinkLMNT! As a parent of high performing athletes we drink LMNT everyday! Can’t wait to try the new flavors!,2026-04-16 14:46:00-05:00,"(10, 1, 0, 0)",LMNT since:2026-02-01
combining citrus salt LMNT drink mix and dark roast black coffee for a culinary experience i would describe as “lackluster” at best,2026-04-16 14:29:00-05:00,"(510, 12, 4, 0)",LMNT since:2026-02-01
"जयपुर प्रवास, मेरा बहुत छोटा था परन्तु बहुत यादगार रहा #Nawalair #Neurotherapist #Neurotherapy #lmnt #neurotherapyinjaipur #Neurotherapistinjaipur #rajasthan",2026-04-16 11:51:00-05:00,"(10, 0, 0, 0)",LMNT since:2026-02-01
LMNT helps. Make sure to do flavorless so you don’t break fast.,2026-04-16 11:51:00-05:00,"(19, 2, 0, 0)",LMNT since:2026-02-01
"Recuerda: Los electrolitos son esenciales durante cualquier ayuno. • Sodio • Potasio • Magnesio Falta de electrolitos = fatiga, dolores de cabeza y mareos durante el ayuno. Usa LMNT, sal de Redmond o mezcla sal marina con agua 1 o 2 veces al día.",2026-04-16 11:43:00-05:00,"(537, 5, 1, 0)",LMNT since:2026-02-01
Qué hacer cuando tienes hambre durante un ayuno: • Beber agua con sal marina o LMNT • Beba café negro o té verde. • Mastica chicle sin azúcar o cepíllate los dientes. • Sal a caminar o haz un movimiento ligero. • Tome una ducha caliente,2026-04-16 11:43:00-05:00,"(1316, 14, 2, 2)",LMNT since:2026-02-01
Lift 1-2hrs after 1 . 2. Intra-Workout (sipped during lifting) LMNT + 10 Domino sugar packets + optional 10-15g EAAs 160-220 cal | 40g C | 0-15g P | 0g F 3. Post-Lifting / Pre-Cardio Honey 2 fl oz (~85g) + 2 scoops whey + 11g collagen peptides 576 cal | 69g C | 60g P | 2g F,2026-04-16 11:03:00-05:00,"(51, 0, 0, 0)",LMNT since:2026-02-01
"Wow! I am so grateful to #LMNT for sending me their latest new flavors! Pink Lemonade and Lemonade + Iced Tea. LMNT is the perfect hydrator for summer! Thank you, LMNT!",2026-04-16 10:14:00-05:00,"(25, 0, 0, 0)",LMNT since:2026-02-01
