tweet,date,stats,query
Any Gabrielly me deixando ansiosa uma hora dessas por motivos de AG1,2026-04-12 20:23:00-05:00,"(80, 0, 0, 0)",ag1 since:2026-02-01
E quando ela lançar o AG1 e vim no post falar que é pra mim tirar???,2026-04-12 20:02:00-05:00,"(253, 3, 0, 0)",ag1 since:2026-02-01
MEU DEUS QUANDO AG1 VIER EU YASMIM VOU SER A PESSOA MAIS FELIZ DO PLANETA,2026-04-12 19:53:00-05:00,"(157, 0, 0, 0)",ag1 since:2026-02-01
“corri fui pra qualquer lugar longe do seu amor porque se isso é amor…” TODO SINAL ME DEIXA EUFÓRICA venhaaa ag1,2026-04-12 19:43:00-05:00,"(131, 5, 0, 0)",ag1 since:2026-02-01
ansiosa pelo AG1,2026-04-12 19:35:00-05:00,"(97, 0, 0, 0)",ag1 since:2026-02-01
E agora? Eu nunca cheguei nessa parte… O AG1 está vindo mesmo!,2026-04-12 19:33:00-05:00,"(633, 0, 0, 0)",ag1 since:2026-02-01
MDS O QUE É ISSO ANY GABRIELLY SUA DOIDA eu preciso ouvir essa música completa AGORA AG1 vai emocionar taaanto 😭,2026-04-12 19:32:00-05:00,"(344, 3, 0, 1)",ag1 since:2026-02-01
spoiler de musica mds eu nem amo naaao veeem AG1 eu to pronta pra ti 😭😭😭😭😭😭😭😭😭,2026-04-12 19:27:00-05:00,"(863, 2, 0, 0)",ag1 since:2026-02-01
inveja da minha eu do futuro que já ouviu o AG1 todinho e já sabe todas as letras que a menina any escreveu,2026-04-12 19:13:00-05:00,"(191, 3, 1, 1)",ag1 since:2026-02-01
queria ouvir o ag1 agora,2026-04-12 19:07:00-05:00,"(1012, 1, 0, 0)",ag1 since:2026-02-01
AG1 did the heavy lifting too.,2026-04-12 18:12:00-05:00,"(112, 0, 1, 0)",ag1 since:2026-02-01
"Not surprised, AG1.",2026-04-12 16:54:00-05:00,"(3, 0, 0, 0)",ag1 since:2026-02-01
AG1 tastes like shit anyways..,2026-04-12 16:33:00-05:00,"(22, 0, 0, 0)",ag1 since:2026-02-01
FUCK AG1….,2026-04-12 16:32:00-05:00,"(12, 0, 0, 0)",ag1 since:2026-02-01
"If you need email inspiration, subscribe to these brands: - Beis - Dr. Squatch - AG1 - Gruns - Magic Mind - Olipop - Seed - Magic Spoon",2026-04-12 14:55:00-05:00,"(555, 7, 2, 1)",ag1 since:2026-02-01
AG1 6 anos OR1 14 anos AG5 12 anos OR2 16 anos AG8 19 anos OR3 19 anos,2026-04-12 12:58:00-05:00,"(278, 7, 0, 0)",ag1 since:2026-02-01
"AG1 has honestly been a game changer. It’s the one thing I take every morning that covers my bases. If you’re curious to try it, you’ll also get a year’s supply of Vitamin D3+K2, 6 travel packs, and $15 off your first order 🙂 fbuy.io/s/03NkhLlU",2026-04-12 11:20:00-05:00,"(37, 0, 0, 0)",ag1 since:2026-02-01
ساعات كارديال +كَـ ـو ـد خـ ـصًـ ـم AM95🫡 عطور بلانكو +كَـ ـو ـد خـ ـصًـ ـم AG1 🫡 تطبيق مطعم بيت الشاورما +كَـ ـو ـد خـ ـصًـ ـم M1 🫡,2026-04-11 22:00:00-05:00,"(67, 1, 0, 0)",ag1 since:2026-02-01
عطور #بلانكو عبير النظافة واللطف في رشة تملأ يومك انتعاشاً✨ ((مع كود الخصم الاضافي AG1))🌸 الرياض #تعليق_الدراسه,2026-04-11 21:31:00-05:00,"(415, 0, 0, 0)",ag1 since:2026-02-01
fixado até o ag1 vir ao mundo!,2026-04-11 18:24:00-05:00,"(584, 1, 0, 0)",ag1 since:2026-02-01
"the AG1 of wearables a low-quality heart-rate monitor that has zero practical value HRV tells you your body is under stress, but is worthless for guidance",2026-04-11 18:00:00-05:00,"(73, 1, 0, 0)",ag1 since:2026-02-01
"I think one thing that people misunderstand on this is this is on the lifetime of the customer (not 12 months) Chad had access to internal data from lots of brands that were 3+ years old. And when you have a brand like Gruns, AG1, etc. - you get a lot of ""terminal subscribers"" - basically people who just stay forever. If you have let's say 10% of your customer base who stay as a terminal sub (at $60/month), that's $6 per month, $72/year and when you project this out it adds up to a serious amount of LTV, and then you get to this ""3:1"" fully burdened CAC to LTV. If you're working on just 12 months, it's going to be difficult to get to those numbers",2026-04-11 17:44:00-05:00,"(16340, 120, 5, 1)",ag1 since:2026-02-01
AG1,2026-04-11 17:04:00-05:00,"(15, 2, 1, 0)",ag1 since:2026-02-01
What’s AG1?,2026-04-11 16:41:00-05:00,"(6, 0, 0, 0)",ag1 since:2026-02-01
I only stan ag1-ag6 and we cant be friends and eternal sunshine (song) on a good. If ag8 is better than sweetener ill gag but as of rt now…,2026-04-11 15:07:00-05:00,"(61, 0, 1, 0)",ag1 since:2026-02-01
Just spit out my AG1!,2026-04-11 13:28:00-05:00,"(392, 2, 1, 0)",ag1 since:2026-02-01
meudeus preciso do ag1 preciso do show com meet da any agora,2026-04-11 13:14:00-05:00,"(26, 2, 0, 0)",ag1 since:2026-02-01
"You’re wrong, Patrick. It was SEO… people googling “AG1 alternative” all the way to a billion dollars",2026-04-11 08:40:00-05:00,"(14, 1, 0, 0)",ag1 since:2026-02-01
Counter positioning it would destroy their brand. I’m shocked that company hasn’t tried to launch a competitor brand though (not completely associated with AG1 but can target people who churn). Bad execution there.,2026-04-11 08:28:00-05:00,"(16, 0, 1, 0)",ag1 since:2026-02-01
side note: why does AG1 still have no gummy,2026-04-11 08:00:00-05:00,"(36, 1, 1, 0)",ag1 since:2026-02-01
"Different arenas. Same inner standard. @nickilange pushes himself across extreme distances as an ultra runner. The players of @englandrugby test their limits every time they step on the pitch. Different sports—but when two of our AG1 partner communities crossed paths, it was clear they speak the same language: consistency, the courage to keep going, and the quiet drive to become a better version of yourself tomorrow. Every day starts as a blank canvas.",2026-04-11 08:00:00-05:00,"(251, 1, 2, 0)",ag1 since:2026-02-01
"A special thanks to this show’s sponsor, @drink_AG1. Head to DrinkAG1.com/cressey and you’ll receive an awesome welcome pack consisting of a free 5-pack of AG1 travel packets, a shaker bottle, and a 600-serving bottle of Vitamin D3+K2 with your first order.",2026-04-11 07:50:00-05:00,"(3183, 4, 0, 2)",ag1 since:2026-02-01
"Want a FREE Miro Board with all the emails we have from AG1, Magic Spoon and Seed Probiotics? Then join my newsletter with weekly insights and I’ll send it for free. 📧 Just click the second link in my X bio.",2026-04-11 07:00:00-05:00,"(53, 0, 0, 0)",ag1 since:2026-02-01
"Want a FREE Miro Board with all the emails we have from AG1, Magic Spoon and Seed Probiotics? Then join my newsletter with weekly insights and I’ll send it for free. 📧 Just click the second link in my X bio.",2026-04-11 05:20:00-05:00,"(67, 0, 0, 0)",ag1 since:2026-02-01
I gave up coffee when I was 26 never had another migraine until 32 bc I drank a Monster Energy. Get rid of high caffeine drinks. I order organic Protein & Energy drink mixes off Amazon. VEGA & Active Green are affordable alts to AG1 and those other streamer sponsored drinks.,2026-04-11 04:40:00-05:00,"(53, 1, 0, 0)",ag1 since:2026-02-01
Agree chasing the gummies format would probably dilute the AG1 brand… Gruns are for performative health enthusiasts - the parents who feed their kids gummies along with chicken nuggets.,2026-04-10 21:32:00-05:00,"(117, 0, 0, 0)",ag1 since:2026-02-01
Yup and he’d have a podcast sponsored by AG1 and Black Rifle Coffee,2026-04-10 20:22:00-05:00,"(155, 1, 1, 0)",ag1 since:2026-02-01
The Gruns success isn’t hard to understand: AG1 and Bloom created massive awareness for greens but were locked into premium health first positioning. The experience sucks. It turns out most people just want to *feel* like they are doing healthy things. This insight was genius.,2026-04-10 19:54:00-05:00,"(10756, 82, 5, 2)",ag1 since:2026-02-01
What’s the current AG1 paradigm that’s about to be Grünnified,2026-04-10 19:04:00-05:00,"(119, 1, 0, 0)",ag1 since:2026-02-01
pois agr quero que o AG1 venha botanto o pau ma mesa SIM,2026-04-10 18:32:00-05:00,"(212, 11, 0, 2)",ag1 since:2026-02-01
"I always thought Gruns was for parents who gave up on trying to get kids to eat veggies. Give them the gummy bears, good enough sort of thing. AG1 is for people who have tried cold plunges.",2026-04-10 18:07:00-05:00,"(113, 0, 0, 0)",ag1 since:2026-02-01
Well done “build to acquisition” playbook Riding AG1 wave of educated buyers supplementing greens + packed in convenient gummies form factor Beautiful,2026-04-10 18:02:00-05:00,"(336, 5, 0, 0)",ag1 since:2026-02-01
"Because it’s off brand and is the opposite of the entire ethos their brand stands for Ag1 sells to consumers who want to pay a premium for their health Gruns consumer is mass market, which see it as candy they can eat",2026-04-10 17:09:00-05:00,"(453, 4, 1, 0)",ag1 since:2026-02-01
"Powder supplement brand AG1 explores options including a sale, sources say reuters.com/legal/transactio…",2026-04-10 16:45:00-05:00,"(459, 1, 0, 0)",ag1 since:2026-02-01
Branding + product market fit + giant tam + 10 years of market education by AG1 + deep understanding of operating fundamentals + direct response + affiliates + retail + VC connections + VC money + selling a portfolio company to Unilever already All with near perfect execution,2026-04-10 16:08:00-05:00,"(13572, 98, 9, 5)",ag1 since:2026-02-01
Branding + product market fit + giant tam + 10 years of market education by AG1 + deep understanding of operating fundamentals + direct response + affiliates + retail + VC connections + VC money + selling a portfolio company to Unilever All with near perfect execution,2026-04-10 16:08:00-05:00,"(1671, 17, 1, 0)",ag1 since:2026-02-01
amiga sim eu literalmente acordo todos os dias pensando nele ag1,2026-04-10 14:43:00-05:00,"(15, 0, 0, 0)",ag1 since:2026-02-01
"Leg spread is the same in AG1 and AG2. AG2 is much more than just animations. If they are working towards better looking animations, now they have a possibility to please 99% of player with way better looking animations, the CSGO equivalent.",2026-04-10 14:38:00-05:00,"(709, 3, 1, 0)",ag1 since:2026-02-01
can you compare the bandwidth reduction from the current ag1 build VS the current AG2 beta build?,2026-04-10 14:33:00-05:00,"(184, 0, 0, 0)",ag1 since:2026-02-01
"AG2 is definitely an improvement, I like it way more than AG1 in overall gameplay. But leg spread and ""launching"" is still a problem and it looks little bit faster than what we had in CSGO.",2026-04-10 13:59:00-05:00,"(40358, 319, 20, 6)",ag1 since:2026-02-01
Do you still take AG1? I had stopped for a bit but debating restarting (just felt like I got sick less…),2026-04-10 13:17:00-05:00,"(1794, 0, 2, 0)",ag1 since:2026-02-01
"Yes, that’s exactly what I’m saying. Grüns ultimately has way larger TAM and I think that’s reflected in their growth trajectory. AG1 has the superior label and has positioned themselves around that, so harder to justify chasing the more mass appeal form factor, IMO.",2026-04-10 13:12:00-05:00,"(192, 1, 0, 0)",ag1 since:2026-02-01
"Most consumers will not dive this deep into the details. If you're saying that AG1 is positioned as purely performance / optimization, it has an inherently smaller TAM than Gruns, which is has the potential to compete against Centrum at this point. To your original point, maybe 2 different categories entirely.",2026-04-10 13:08:00-05:00,"(294, 3, 1, 0)",ag1 since:2026-02-01
"Are you suggested that AG1's form factor is a distinctive brand asset? I've always thought of it as a start and not and end, and expected an evolution and diversification of form factor (but that's just me). The powder tends to cause a mess and I'd have to think it's seen as a liability for many (esp when traveling).",2026-04-10 12:55:00-05:00,"(36, 0, 1, 0)",ag1 since:2026-02-01
I'm not sure if that's how consumers see it? Gruns obviously marketed to steal share from AG1 and tout the same baseline benefits. They feel like substitute products to me.,2026-04-10 12:53:00-05:00,"(569, 4, 1, 0)",ag1 since:2026-02-01
"(And though gummy bears has way more mass market appeal, the form factor is counter to everything the AG1 brand represents. See also: Anne Mahlum’s thoughts on Solidcore adding mat Pilates)",2026-04-10 12:50:00-05:00,"(36, 0, 1, 0)",ag1 since:2026-02-01
Honestly just totally different products IMO. Both are remarkable brands but with very different targets. Grüns are for people who would rather eat gummy bears than maximize health; AG1 is for people who would rather maximize health than eat gummy bears.,2026-04-10 12:48:00-05:00,"(541, 1, 3, 0)",ag1 since:2026-02-01
We just got a $1.2B answer to this. I wonder why AG1 never launched gummies and allowed Gruns to just run away with the product form factor (if it's called that in CPG).,2026-04-10 12:42:00-05:00,"(14701, 53, 3, 0)",ag1 since:2026-02-01
"Powder supplement brand AG1 explores options including a sale, sources say reuters.com/legal/transactio…",2026-04-10 12:40:00-05:00,"(406, 1, 0, 0)",ag1 since:2026-02-01
And how much compared ag1 and ag2?,2026-04-10 12:34:00-05:00,"(253, 0, 0, 0)",ag1 since:2026-02-01
Brands I sometimes steal email ideas from: - Magic Mind - Lunavia - IM8 - Dose - Neutonic - Sports Research - Heights - Deplogy - Loop - arrae - AG1 - Javy Coffee - Rael I've got no idea how any of these brands are performing in terms of revenue / profit.,2026-04-10 11:56:00-05:00,"(270, 7, 2, 1)",ag1 since:2026-02-01
"A few narrative violations @chadjanis and team just hit us with... → the greens category is spoken for (e.g., AG1) → don't raise big money early → supplements don't get good M&A multiples → stay away from temp-sensitive categories → gummies are an ops disaster...avoid! → don't raise at huge valuations a year or two in → don't launch new product lines fast → don't break out lines into separate DTC stores All emphatically disproven in this case. With an A+ team and A+ product-market fit, the ""rules"" that industry gurus parrot go out the window. In other words, there is no playbook. Run from anyone claiming otherwise. Congrats to the whole team. I've never seen anything quite like this in CPG.",2026-04-10 11:45:00-05:00,"(6857, 103, 7, 5)",ag1 since:2026-02-01
Osimhen sana direkt ag1z dan vererek az kalmış geberip gidiyordun seninkisi gözükmüyor bile demiştir bu ne biçim bebek ag1 z dan hep veriyor osimhen sana oe seni,2026-04-10 11:39:00-05:00,"(34, 0, 0, 0)",ag1 since:2026-02-01
"By popular request, my stack: 6 sprays ketamine upon waking Creatine gummy injected into my left buttcheek 20mg Lexapro 2 fat lines of AG1 snorted after lunch 1g cocaine every 5 hours Horse electrolytes Never felt better",2026-04-10 10:53:00-05:00,"(1417, 12, 5, 0)",ag1 since:2026-02-01
"Guys, I'm losing my marbles. The level of talent coming on The Starters is absolutely insane. This week, we've added: - AG1's Amazon leader - Social media expert from Liquid Death & Blueprint - Head of CRM @ L'Oreal - CX leader from Ryze Superfoods & IPSY Heading into the weekend feeling GREAT knowing our members are just a few clicks away from accessing the most brilliant humans in the world of e-commerce.",2026-04-10 10:33:00-05:00,"(570, 7, 1, 0)",ag1 since:2026-02-01
AG1 TÁ MTO PERTO CARALHOO,2026-04-10 10:00:00-05:00,"(74, 7, 0, 2)",ag1 since:2026-02-01
AG1,2026-04-10 09:28:00-05:00,"(3, 0, 0, 0)",ag1 since:2026-02-01
AG1 is shit too,2026-04-10 06:51:00-05:00,"(65, 1, 0, 0)",ag1 since:2026-02-01
AG1 TÁ NASCENDO CACETE,2026-04-10 06:44:00-05:00,"(22, 0, 0, 0)",ag1 since:2026-02-01
Meu Deus isso tá lindo!!!! AG1 vem pra mim pfv!! Any vai entregar um tesouro pra gente com esse álbum ❤️,2026-04-10 06:24:00-05:00,"(61, 0, 0, 0)",ag1 since:2026-02-01
NÃO ACREDITO QUE AGORA O AG1 TÁ VINDO MESMO,2026-04-10 04:30:00-05:00,"(20, 0, 0, 0)",ag1 since:2026-02-01
nem acredito que eu aumentei o volume e realmente ouvi ela cantando aí que ansiedade felicidade estou sentimento várias emoções juntas vem ag1,2026-04-10 04:03:00-05:00,"(444, 35, 0, 1)",ag1 since:2026-02-01
I watched a 90 minute @9operators podcast for this info and honestly I'm still thinking about it 30 days later. The 4 qualities of an efficient person by the CEO of AG1: - Courage — willingness to speak up when uncomfortable - Confidence — belief that you belong at the table - Humility — belief that you can't do it alone - Curiosity — wonder and desire to ask why,2026-04-10 04:00:00-05:00,"(103, 0, 0, 0)",ag1 since:2026-02-01
desync is much worse on AG2 and full speed strafe animation introduce more confusion than AG1. played on polish ip u pasted here,2026-04-10 03:06:00-05:00,"(940, 0, 2, 0)",ag1 since:2026-02-01
Is that the new ag1? 😂,2026-04-10 02:56:00-05:00,"(21, 0, 0, 0)",ag1 since:2026-02-01
AG1 TÁ MAIS PERTO QUE NUNCA,2026-04-10 02:32:00-05:00,"(121, 5, 0, 0)",ag1 since:2026-02-01
"AG1 testing finished! ms definitely higher and a lot more spikes, also around 10-20 fps less than AG2 Video: medal.tv/games/counter-strik…",2026-04-10 01:36:00-05:00,"(31, 0, 1, 0)",ag1 since:2026-02-01
"sério, o amor que eu sinto por você é o mais puro do mundo, eu não sei viver em um mundo em que vc não esteja nele. Você não imagina o quanto eu te amo e como você ilumina todos ao seu redor com a sua doçura e talento, to ansiosa pro ag1 môr, te amo!!!",2026-04-10 01:08:00-05:00,"(71, 0, 0, 0)",ag1 since:2026-02-01
"Alright did more testing on AG2, basically above 800 im getting some high ms spikes. FPS_max 750 is the best on my testing! Will test AG1 later to compare results Video : medal.tv/games/counter-strik…",2026-04-10 00:56:00-05:00,"(38, 1, 1, 0)",ag1 since:2026-02-01
AG1,2026-04-10 00:44:00-05:00,"(4, 0, 0, 0)",ag1 since:2026-02-01
o ag1 tá vivooooooo,2026-04-09 23:22:00-05:00,"(60, 0, 0, 0)",ag1 since:2026-02-01
"AG1 eu ja sinto os teus sinais, pode vim que eu to prontaaaa",2026-04-09 23:13:00-05:00,"(119, 14, 0, 6)",ag1 since:2026-02-01
"AI PORRA, CARALHO, ANY GABRIELLY CALMA AI, UMA HORA DESSA MULHER CALMA VAI NASCER, AI MEU CORAÇÃO TÁ NASCENDO ALGUÉM ME LEVA PRO HOSPITAL QUE EU TÔ SENTINDO QUE ELA VAI PARIR O AG1",2026-04-09 22:55:00-05:00,"(155, 4, 0, 2)",ag1 since:2026-02-01
TO PRONTISSIMA PRO AG1,2026-04-09 22:45:00-05:00,"(153, 6, 0, 0)",ag1 since:2026-02-01
Very much agree. They should be at $20 to $25M ARR by end of 2026. Guidance for 2027 was $350m to $400m. AG1 raised at a $1.2b valuation when revenues were around $200m,2026-04-09 22:38:00-05:00,"(88, 1, 1, 0)",ag1 since:2026-02-01
Eita que eu acho que o AG1 tá mais perto do que a gente imagina,2026-04-09 22:38:00-05:00,"(56, 1, 0, 0)",ag1 since:2026-02-01
『後発xサプリ市場→2年で約1800億円でユニリーバが買収』グミ型サプリGrünsの勝ち方 後発×既存市場でも数年で2-3億いけるECブランドは多く、AIでもモノの販売は消えないからチャンス。大手買収も増える↓ ①創業者が粉末サプリ飲んで「30日続かないわ」と感じ、AG1が王者の市場にあえて参入 ②粉末の「不味い・続かない」をグミにすることで解決 ③商品開発に1年。100人以上と味・匂い・個数まで検証 ④CACとLTVの基準が異常→純利益ベースで最低3倍を死守 ⑤小規模インフルエンサーを大量活用して拡散 ⑥まずオンライン販売で勝つ→Amazon→Walmart→Costcoの順で拡大 ⑦棚から消える速度がカテゴリ平均の4.3倍 ⑧在庫は6〜9ヶ月先を予測して先回り発注 ⑨流行カテゴリには張らない。ニーズがずっと消えない市場だけ張る → 結果：14ヶ月で黒字 / 2年で約1800億円でユニリーバが買収発表 新しいものは発明してない 既に売れてる市場で 「より続けやすく・より広めやすく・より利益が残る形」に再設計して勝った 海外D2Cは日本未上陸が多いし、後発で勝ち始めてるものを日本に持ってくるだけで、開発せずとも差別化された商品を扱える可能性があるので、見ておくといい,2026-04-09 22:37:00-05:00,"(23541, 112, 3, 14)",ag1 since:2026-02-01
VEM AG1,2026-04-09 22:36:00-05:00,"(34, 2, 0, 1)",ag1 since:2026-02-01
AG1 IS COMING PORRAAAAAA🤸🏻🤸🏻🤸🏻🤸🏻,2026-04-09 22:35:00-05:00,"(168, 24, 0, 7)",ag1 since:2026-02-01
ANY GABRIELLY AG1 ÁLBUM TA VINDO SENTE SENTE CONTEMPLA IRMA,2026-04-09 22:33:00-05:00,"(217, 3, 1, 0)",ag1 since:2026-02-01
it could be just optimization due to how essentially everything game related is sent over the network. if i understand how multiplayer games work. for instance animgraph2 could handle animation updates more efficiently than ag1. it could also just be cope/placebo,2026-04-09 21:24:00-05:00,"(1787, 4, 0, 0)",ag1 since:2026-02-01
"Ag9-2028/29 Ag10-2032/33 Ag11-2035/36 Ag12-2039-2040. Ag12 will be her last album, starting ag1 with yours truly, and ending ag12 with a self titled album. Yours truly, Ariana Grande.",2026-04-09 20:02:00-05:00,"(119, 3, 0, 0)",ag1 since:2026-02-01
"I don’t get one thing. The SS says it’s a comparison between ag1 and ag2, but your text says it’s between ag2 old and ag2 updated. So what is it, brother?",2026-04-09 19:34:00-05:00,"(96, 0, 1, 0)",ag1 since:2026-02-01
What exactly are the limitations of AG1?,2026-04-09 19:27:00-05:00,"(153, 0, 1, 0)",ag1 since:2026-02-01
I think the reason AG1 didn’t make their own gummy bears is because they want to be a brand that actually provides real nutrition,2026-04-09 19:04:00-05:00,"(434, 1, 0, 0)",ag1 since:2026-02-01
"Hi @ZPostFacto, I see you are the author of this blog post, can you provide us a quick comparison between AG1 vs AG2 Network Bandwidth Utilization?",2026-04-09 18:20:00-05:00,"(16546, 83, 1, 1)",ag1 since:2026-02-01
AG1 babayyy,2026-04-09 17:30:00-05:00,"(25, 1, 0, 0)",ag1 since:2026-02-01
Proof that pioneering a category is overrated. AG1 did all that and Chad won by improving the mechanism.,2026-04-09 17:17:00-05:00,"(91, 1, 0, 0)",ag1 since:2026-02-01
AG1 🥑 IM8 🎈 Gruns 🦖 Primal Queen 🌸 All use this one method from Chemistry to find winning ads every week lol (you probably learnt it in school) It's called Alloying 🧵👇🏽,2026-04-09 16:08:00-05:00,"(112, 1, 1, 0)",ag1 since:2026-02-01
Never underestimate ego The folks at AG1 have a “scientific” reputation to uphold and offering a childish gummy was beneath them,2026-04-09 15:39:00-05:00,"(224, 1, 0, 0)",ag1 since:2026-02-01
"AG1 did the heavy lifting w educating consumers about supplementing their greens Chad realized powder as a form factor is terrible UI/UX Formulates it in gummy (portable, better tasting, etc) Laser-focus on *fully burdened* LTV/CAC being >3x $1.2B sale",2026-04-09 15:35:00-05:00,"(563, 5, 0, 1)",ag1 since:2026-02-01
"AG1 did the heavy lifting w educating consumers about supplementing their greens Chad realized powder as a form factor is terrible UI/UX Formulates it in gummy (portable, better tasting, etc) Laser-focus on *fully burdened* LTV/CAC being >3x $1.2B sale",2026-04-09 15:34:00-05:00,"(1254, 12, 1, 0)",ag1 since:2026-02-01
i dont think if ag1 made a gummy form gruns would be affected at all. gruns became a unicorn for the simple reason that chad is a high level operator. competition is not as important realistically as people make it seem,2026-04-09 15:25:00-05:00,"(734, 3, 0, 0)",ag1 since:2026-02-01
🎺 Grüns is smart not because of their marketing system or influencers. They got to 1.2B because they piggybacked of AG1 with a product that removed the limitations of AG1. AG1 did 12+ years of awareness for greens. Grüns came in and took that awareness with a more accessible product.,2026-04-09 15:02:00-05:00,"(5630, 39, 2, 3)",ag1 since:2026-02-01
"I'd bet entrepreneurs like Chad Janis would win whether or not AG1 stepped in the market. So my point is the lesson might not be ""don’t overestimate the competition"", but rather just ignore the competition altogether.",2026-04-09 14:44:00-05:00,"(364, 1, 1, 0)",ag1 since:2026-02-01
"AG1 did the heavy lifting w educating consumers about supplementing their greens Chad realized powder as a form factor is terrible UI/UX Formulates it in gummy (portable, better tasting, etc) Laser focus on optimizing LTV/CAC $1.2B sale",2026-04-09 14:38:00-05:00,"(9415, 48, 3, 0)",ag1 since:2026-02-01
The AG1 and AG2 girlies… lmfao!!,2026-04-09 14:28:00-05:00,"(61, 0, 0, 0)",ag1 since:2026-02-01
Almost Is Never Enough | AG1 Break Your Heart Right Back | AG2 Into You | AG3 Everytime | AG4 Bad Idea | AG5 positions | AG6 eternal sunshine | AG7,2026-04-09 14:24:00-05:00,"(294, 5, 1, 0)",ag1 since:2026-02-01
"Is this the right lesson? If AG1 had made their own gummy bears, would the outcome have changed?",2026-04-09 14:23:00-05:00,"(1392, 0, 1, 0)",ag1 since:2026-02-01
"""If you run unaware traffic to a product page, it's just not going to work."" That's Carl Weische, who runs CRO for AG1, IM8, Huel, The Oodie, and 200+ other 8 and 9-figure DTC brands. This one line explains why most $1 to $5M ecom brands can't scale Meta:",2026-04-09 13:32:00-05:00,"(167, 4, 1, 0)",ag1 since:2026-02-01
"Designed an email for AG1 — turning daily nutrition into a simple, high-converting experience. Less clutter. More clarity. More conversions. #Email_Design #Email_Marketting #e_Commerce",2026-04-09 13:00:00-05:00,"(42, 0, 0, 0)",ag1 since:2026-02-01
ag1 ag8,2026-04-09 12:53:00-05:00,"(54274, 6467, 25, 782)",ag1 since:2026-02-01
I've been an AG1 customer for a couple years now and it's unbelievable how much I actually hate the product and think it tastes like trash. Makes me feel good tho. Feeling convinced now to try out gruns. Thoughts?,2026-04-09 12:13:00-05:00,"(261, 1, 2, 0)",ag1 since:2026-02-01
"He wouldn't be sponsored by scams like AG1, Better help, Stupid ass MAGA coffee and beef testicle supplements if he had an ounce of integrity and wasn't doing the podcast for straight up cash.",2026-04-09 11:43:00-05:00,"(121, 2, 1, 0)",ag1 since:2026-02-01
